,eid,doi,pii,pubmed_id,title,subtype,subtypeDescription,creator,afid,affilname,affiliation_city,affiliation_country,author_count,author_names,author_ids,author_afids,coverDate,coverDisplayDate,publicationName,issn,source_id,eIssn,aggregationType,volume,issueIdentifier,article_number,pageRange,description,authkeywords,citedby_count,openaccess,freetoread,freetoreadLabel,fund_acr,fund_no,fund_sponsor
130,2-s2.0-85000997254,10.1007/s00521-016-2717-6,,,Chaotic metaheuristic algorithms for learning and reproduction of robot motion trajectories,ar,Article,Mitić M.,,University of Belgrade,Belgrade,Serbia,,,,,2018-08-01,1 August 2018,Neural Computing and Applications,09410643,24800,,Journal,30,4,,1065-1083,,,15,0,,,,,
131,2-s2.0-85051562962,,,,"Proceedings of the 2018 19th International Conference on Research and Education in Mechatronics, REM 2018",cr,Conference Review,,,,,,,,,,2018-07-27,27 July 2018,"Proceedings of the 2018 19th International Conference on Research and Education in Mechatronics, REM 2018",,21100872758,,Conference Proceeding,,,,,,,0,0,,,,,
132,2-s2.0-85050679106,10.2316/Journal.206.2018.4.206-5084,,,Reinforcement learning and ega-based trajectory planning for dual robots,ar,Article,Liu Y.,,Dalian University of Technology,Dalian,China,,,,,2018-07-26,26 July 2018,International Journal of Robotics and Automation,08268185,25482,,Journal,33,4,,367-378,,,8,0,,,,,
133,2-s2.0-85061015635,10.1145/3229631.3229634,,,A new generic HLS approach for heterogeneous computing: On the feasibility of high-level synthesis in HSA-compatible systems,cp,Conference Paper,Holzinger P.,,Friedrich-Alexander-Universität Erlangen-Nürnberg,Erlangen,Germany,,,,,2018-07-15,15 July 2018,ACM International Conference Proceeding Series,,11600154611,,Conference Proceeding,,,,18-27,,,2,0,,,,,
134,2-s2.0-85050726560,10.1109/I2MTC.2018.8409769,,,Classification of eye gestures using machine learning for use in embedded switch controller,cp,Conference Paper,O'Bard B.,,"California State University, Fullerton",Fullerton,United States,,,,,2018-07-10,10 July 2018,"I2MTC 2018 - 2018 IEEE International Instrumentation and Measurement Technology Conference: Discovering New Horizons in Instrumentation and Measurement, Proceedings",,21100870568,,Conference Proceeding,,,,1-6,,,7,0,,,,,
135,2-s2.0-85052018305,10.1145/3200947.3201063,,,Control a robot via internet using a block programming platform for educational purposes,cp,Conference Paper,Bakali I.,,University of the Aegean,Mytilene,Greece,,,,,2018-07-09,9 July 2018,ACM International Conference Proceeding Series,,11600154611,,Conference Proceeding,,,,,,,1,0,,,,,
136,2-s2.0-85050849489,10.1109/CCDC.2018.8407723,,,Innovate engineering education by using virtual laboratory platform based industrial robot,cp,Conference Paper,Li C.,,Beihang University,Beijing,China,,,,,2018-07-06,6 July 2018,"Proceedings of the 30th Chinese Control and Decision Conference, CCDC 2018",,21100870886,,Conference Proceeding,,,,3467-3472,,,9,0,,,,,
137,2-s2.0-85050659982,10.1109/MECO.2018.8405982,,,Development of educational cyber-physical Internet of Things platform: Study of the PID controller,cp,Conference Paper,Škraba A.,,Univerza v Mariboru,Maribor,Slovenia,,,,,2018-07-06,6 July 2018,"2018 7th Mediterranean Conference on Embedded Computing, MECO 2018 - Including ECYPS 2018, Proceedings",,21100870326,,Conference Proceeding,,,,1-4,,,3,0,,,,,
138,2-s2.0-85065987823,10.1109/IS.2018.8710525,,,Learning from Virtual Experience: Mapless Navigation with Neuro-Fuzzy Intelligence,cp,Conference Paper,Khaksar W.,,Universitetet i Oslo,Oslo,Norway,,,,,2018-07-02,2 July 2018,"9th International Conference on Intelligent Systems 2018: Theory, Research and Innovation in Applications, IS 2018 - Proceedings",,21100924702,,Conference Proceeding,,,8710525,117-124,,,4,0,,,,,
139,2-s2.0-85065175824,10.1109/IIAI-AAI.2018.00049,,,Construction of Teaching Assistant Robot in Programming Class,cp,Conference Paper,Yoshino K.,,Kanagawa Institute of Technology,Atsugi,Japan,,,,,2018-07-02,2 July 2018,"Proceedings - 2018 7th International Congress on Advanced Applied Informatics, IIAI-AAI 2018",,21100923622,,Conference Proceeding,,,8693427,215-220,,,5,0,,,,,
140,2-s2.0-85064934562,10.1109/FSKD.2018.8687137,,,An educational arduino robot for visual deep learning experiments,cp,Conference Paper,Hu H.,,Renmin University of China,Beijing,China,,,,,2018-07-02,2 July 2018,"ICNC-FSKD 2018 - 14th International Conference on Natural Computation, Fuzzy Systems and Knowledge Discovery",,21100922631,,Conference Proceeding,,,8687137,1310-1314,,,1,0,,,,,
141,2-s2.0-85064140045,10.1109/ROBIO.2018.8665148,,,Integration of Visual Information and Robot Offline Programming System for Improving Automatic Deburring Process,cp,Conference Paper,Lai Z.,,Guangdong University of Technology,Guangzhou,China,,,,,2018-07-02,2 July 2018,"2018 IEEE International Conference on Robotics and Biomimetics, ROBIO 2018",,21100921167,,Conference Proceeding,,,8665148,1132-1137,,,8,0,,,,,
142,2-s2.0-85064137587,10.1109/ROBIO.2018.8664846,,,Automatic Tool Path Planning Strategy Based on Feature Extraction of 3D Models,cp,Conference Paper,Tong J.,,University Town of Shenzhen,Shenzhen,China,,,,,2018-07-02,2 July 2018,"2018 IEEE International Conference on Robotics and Biomimetics, ROBIO 2018",,21100921167,,Conference Proceeding,,,8664846,1677-1682,,,2,0,,,,,
143,2-s2.0-85064126844,10.1109/ROBIO.2018.8664765,,,The Playback Trajectory Optimization Algorithm for Collaborative Robot,cp,Conference Paper,Chen Y.,,Beihang University,Beijing,China,,,,,2018-07-02,2 July 2018,"2018 IEEE International Conference on Robotics and Biomimetics, ROBIO 2018",,21100921167,,Conference Proceeding,,,8664765,1671-1676,,,2,0,,,,,
144,2-s2.0-85064113799,10.1109/ROBIO.2018.8664813,,,Towards Deep Reinforcement Learning Based Chinese Calligraphy Robot,cp,Conference Paper,Wu R.,,Xiamen University,Xiamen,China,,,,,2018-07-02,2 July 2018,"2018 IEEE International Conference on Robotics and Biomimetics, ROBIO 2018",,21100921167,,Conference Proceeding,,,8664813,507-512,,,8,0,,,,,
145,2-s2.0-85064111824,10.1109/ROBIO.2018.8665328,,,Sparse Reward Based Manipulator Motion Planning by Using High Speed Learning from Demonstrations,cp,Conference Paper,Zuo G.,,Beijing University of Technology,Beijing,China,,,,,2018-07-02,2 July 2018,"2018 IEEE International Conference on Robotics and Biomimetics, ROBIO 2018",,21100921167,,Conference Proceeding,,,8665328,518-523,,,0,0,,,,,
146,2-s2.0-85052020636,10.1145/3197091.3205827,,,Crafting engaging programming experiences for young people in GLAM spaces: The iOi-sphere,cp,Conference Paper,Parker A.,,Falmouth University,Falmouth,United Kingdom,,,,,2018-07-02,2 July 2018,"Annual Conference on Innovation and Technology in Computer Science Education, ITiCSE",1942647X,21100197182,,Conference Proceeding,,,,394,,,1,0,repositoryam,Green,,,
147,2-s2.0-85081984879,10.1109/ICRIEECE44171.2018.9009281,,,Implementation of a Fuzzy Controller on Low-Cost Embedded Systems for Learning Process Control,cp,Conference Paper,Buele J.,,Universidad Técnica de Ambato,Ambato,Ecuador,,,,,2018-07-01,July 2018,"2018 International Conference on Recent Innovations in Electrical, Electronics and Communication Engineering, ICRIEECE 2018",,21100972403,,Conference Proceeding,,,9009281,1421-1426,,,0,0,,,,,
148,2-s2.0-85063306812,10.1109/LRA.2018.2800031,,,Vision-Based Online Adaptation of Motion Primitives to Dynamic Surfaces: Application to an Interactive Robotic Wiping Task,ar,Article,Dometios A.C.,,National Technical University of Athens,Athens,Greece,,,,,2018-07-01,July 2018,IEEE Robotics and Automation Letters,,21100900379,23773766,Journal,3,3,,1410-1417,,,20,0,,,,,
149,2-s2.0-85063304243,10.1109/LRA.2018.2801794,,,Learning Ground Traversability from Simulations,ar,Article,Chavez-Garcia R.O.,,Scuola Universitaria Professionale della Svizzera Italiana,Manno,Switzerland,,,,,2018-07-01,July 2018,IEEE Robotics and Automation Letters,,21100900379,23773766,Journal,3,3,,1695-1702,,,43,0,repositoryam,Green,,,
150,2-s2.0-85060317628,10.1109/LRA.2018.2801479,,,A Solution to Time-Varying Markov Decision Processes,ar,Article,Liu L.,,Indiana University Bloomington,Bloomington,United States,,,,,2018-07-01,July 2018,IEEE Robotics and Automation Letters,,21100900379,23773766,Journal,3,3,,1631-1638,,,23,1,repositoryam,Green,,,
151,2-s2.0-85055544839,10.13973/j.cnki.robot.180139,,,Personalized Gait Planning Method for the Lower-Limb Rehabilitation Training Robot with the Physiotherapist Interaction,ar,Article,Guo B.,,Henan University of Science and Technology;Henan Provincial Key Laboratory of Robotics and Intelligent Systems,Luoyang;Luoyang,China;China,,,,,2018-07-01,1 July 2018,Jiqiren/Robot,10020446,18056,,Journal,40,4,,,,,1,0,,,,,
152,2-s2.0-85055471712,10.13973/j.cnki.robot.180164,,,Demonstration Programming and Optimization Method of Cooperative Robot Based on Multi-Source Information Fusion,ar,Article,Wang F.,,"Faculty of Robot Science and Engineering, Northeastern University",Shenyang,China,,,,,2018-07-01,1 July 2018,Jiqiren/Robot,10020446,18056,,Journal,40,4,,551-559,,,9,0,,,,,
153,2-s2.0-85048915703,10.1007/s10639-017-9677-z,,,"Lines, roamers, and squares: Oh my! using floor robots to enhance Hispanic students’ understanding of programming",ar,Article,Elizabeth Casey J.,,Texas A and M International University,Laredo,United States,,,,,2018-07-01,1 July 2018,Education and Information Technologies,13602357,144955,15737608,Journal,23,4,,1531-1546,,,12,0,,,,,
154,2-s2.0-85036504772,10.1007/s00366-017-0553-7,,,RoboSim: a simulation environment for programming virtual robots,ar,Article,Gucwa K.J.,,"University of California, Davis",Davis,United States,,,,,2018-07-01,1 July 2018,Engineering with Computers,01770667,18186,14355663,Journal,34,3,,475-485,,,7,0,,,,,
155,2-s2.0-85050194331,10.1109/SeGAH.2018.8401364,,,Gamification and virtual reality for teaching mobile x-ray imaging,cp,Conference Paper,Süncksen M.,,Fachhochschule Flensburg,Flensburg,Germany,,,,,2018-06-29,29 June 2018,"2018 IEEE 6th International Conference on Serious Games and Applications for Health, SeGAH 2018",,21100868910,,Conference Proceeding,,,,1-7,,,15,0,,,,,
156,2-s2.0-85049897000,10.23919/CISTI.2018.8399187,,,Learning basic robotics and VAL II programming with LEGO Mindstorms robots,cp,Conference Paper,Calvo I.,,Universidad del Pais Vasco,Leioa,Spain,,,,,2018-06-27,27 June 2018,"Iberian Conference on Information Systems and Technologies, CISTI",21660727,21100219921,21660735,Conference Proceeding,2018-June,,,1-6,,,0,0,,,,,
157,2-s2.0-85049887337,10.23919/CISTI.2018.8399263,,,A virtual robot solution to support programming learning an open source approach,cp,Conference Paper,Aparicio J.T.,,Iscte – Instituto Universitário de Lisboa,Lisbon,Portugal,,,,,2018-06-27,27 June 2018,"Iberian Conference on Information Systems and Technologies, CISTI",21660727,21100219921,21660735,Conference Proceeding,2018-June,,,1-6,,,4,0,,,,,
158,2-s2.0-85051230909,,,,An arduino-based programmable logic control (PLC) lab activity for undergraduate engineering and technology (ETM) students,cp,Conference Paper,Cohenour C.,,Ohio University,Athens,United States,,,,,2018-06-23,23 June 2018,"ASEE Annual Conference and Exposition, Conference Proceedings",,21100797240,21535965,Conference Proceeding,2018-June,,,,,,2,0,,,,,
159,2-s2.0-85051225655,,,,Let's not throw away that big and bulky manipulator - Revitalize It!,cp,Conference Paper,Duong T.H.,,Colorado State University-Pueblo,Pueblo,United States,,,,,2018-06-23,23 June 2018,"ASEE Annual Conference and Exposition, Conference Proceedings",,21100797240,21535965,Conference Proceeding,2018-June,,,,,,1,0,,,,,
160,2-s2.0-85051223200,,,,Harnessing state-of-the-art internet of things labs to motivate first-year electrical and computer engineering students,cp,Conference Paper,Orser D.J.,,University of Minnesota Twin Cities,Minneapolis,United States,,,,,2018-06-23,23 June 2018,"ASEE Annual Conference and Exposition, Conference Proceedings",,21100797240,21535965,Conference Proceeding,2018-June,,,,,,7,0,,,,,
161,2-s2.0-85051215865,,,,Assessment of an industry-sponsored mechatronics capstone design project,cp,Conference Paper,Marshall M.,,Kennesaw State University,Kennesaw,United States,,,,,2018-06-23,23 June 2018,"ASEE Annual Conference and Exposition, Conference Proceedings",,21100797240,21535965,Conference Proceeding,2018-June,,,,,,0,0,,,,,
162,2-s2.0-85051215137,,,,Multi-sensors for robot teaming using raspberry Pi and VEX robotics construction kit,cp,Conference Paper,He S.,,Vaughn College,Flushing,United States,,,,,2018-06-23,23 June 2018,"ASEE Annual Conference and Exposition, Conference Proceedings",,21100797240,21535965,Conference Proceeding,2018-June,,,,,,2,0,,,,,
163,2-s2.0-85051211091,,,,A tale of the robot: Will virtual reality enhance student learning of industrial robotics?,cp,Conference Paper,Chang Y.,,Illinois State University,Chicago,United States,,,,,2018-06-23,23 June 2018,"ASEE Annual Conference and Exposition, Conference Proceedings",,21100797240,21535965,Conference Proceeding,2018-June,,,,,,3,0,,,,,
164,2-s2.0-85051210544,,,,Misconceptions and the notional machine in very young programming learners (RTP),cp,Conference Paper,Lowe T.,,Purdue University,West Lafayette,United States,,,,,2018-06-23,23 June 2018,"ASEE Annual Conference and Exposition, Conference Proceedings",,21100797240,21535965,Conference Proceeding,2018-June,,,,,,0,0,,,,,
165,2-s2.0-85051203289,,,,Work in progress: Introductory mobile robotics and computer vision laboratories using ROS and MATLAB,cp,Conference Paper,Avanzato R.,,Penn State Abington,Abington,United States,,,,,2018-06-23,23 June 2018,"ASEE Annual Conference and Exposition, Conference Proceedings",,21100797240,21535965,Conference Proceeding,2018-June,,,,,,4,0,,,,,
166,2-s2.0-85051191163,,,,Conceptual framework for integrating a wireless sensor and control network into a robotics course for senior students of mechanical engineering technology,cp,Conference Paper,Zhang Z.,,New York City College of Technology,New York,United States,,,,,2018-06-23,23 June 2018,"ASEE Annual Conference and Exposition, Conference Proceedings",,21100797240,21535965,Conference Proceeding,2018-June,,,,,,3,0,,,,,
167,2-s2.0-85051190972,,,,Structured programing methodology and its role in cognitive development in problem solving skills,cp,Conference Paper,Farook O.,,Purdue University,West Lafayette,United States,,,,,2018-06-23,23 June 2018,"ASEE Annual Conference and Exposition, Conference Proceedings",,21100797240,21535965,Conference Proceeding,2018-June,,,,,,0,0,,,,,
168,2-s2.0-85051185156,,,,Design and implementation of a new instrumentation and interface undergraduate course using LabVIEWTM myDAQ,cp,Conference Paper,Pecen R.R.,,Sam Houston State University,Huntsville,United States,,,,,2018-06-23,23 June 2018,"ASEE Annual Conference and Exposition, Conference Proceedings",,21100797240,21535965,Conference Proceeding,2018-June,,,,,,0,0,,,,,
169,2-s2.0-85051178231,,,,Software-hardware integration of system design discipline,cp,Conference Paper,Yu W.,,Purdue University Northwest,Westville,United States,,,,,2018-06-23,23 June 2018,"ASEE Annual Conference and Exposition, Conference Proceedings",,21100797240,21535965,Conference Proceeding,2018-June,,,,,,0,0,,,,,
170,2-s2.0-85051173151,,,,Design of a modular educational robotics platform for multidisciplinary education,cp,Conference Paper,Wei Z.,,Rose Hulman Institute Technology,Terre Haute,United States,,,,,2018-06-23,23 June 2018,"ASEE Annual Conference and Exposition, Conference Proceedings",,21100797240,21535965,Conference Proceeding,2018-June,,,,,,2,0,,,,,
171,2-s2.0-85051169774,,,,AAS controls technology stackable degree education requirements for employees by highly automated manufacturing companies drives a collaborative pathway at weber state university,cp,Conference Paper,McCulley J.,,Weber State University,Ogden,United States,,,,,2018-06-23,23 June 2018,"ASEE Annual Conference and Exposition, Conference Proceedings",,21100797240,21535965,Conference Proceeding,2018-June,,,,,,0,0,,,,,
172,2-s2.0-85050176876,10.1109/EBBT.2018.8391459,,,Proposed system of artificial Neural Network for positioning and navigation of UAV-UGV,cp,Conference Paper,Kurdi M.M.,,Belarusian National Technical University,Minsk,Belarus,,,,,2018-06-20,20 June 2018,"2018 Electric Electronics, Computer Science, Biomedical Engineerings' Meeting, EBBT 2018",,21100868911,,Conference Proceeding,,,,1-6,,,10,0,,,,,
173,2-s2.0-85084177795,10.1145/3211332.3211335,,,MakeCode and CODAL: Intuitive and efficient embedded systems programming for education,ar,Article,Devine J.,,Lancaster University,Lancaster,United Kingdom,,,,,2018-06-19,19 June 2018,ACM SIGPLAN Notices,15232867,19700185000,,Journal,53,6,,19-30,,,7,1,repositoryam,Green,,,
174,2-s2.0-85051492925,10.1145/3202185.3210773,,,DBugs: Large-scale artefacts for collaborative computer programming,cp,Conference Paper,Bodén M.,,The University of Queensland,Brisbane,Australia,,,,,2018-06-19,19 June 2018,IDC 2018 - Proceedings of the 2018 ACM Conference on Interaction Design and Children,,21100872716,,Conference Proceeding,,,,545-550,,,1,0,,,,,
175,2-s2.0-85051454723,10.1145/3202185.3205869,,,STEAM Learning in formal and informal settings via craft and maker projects,cp,Conference Paper,Kahn K.,,University of Oxford,Oxford,United Kingdom,,,,,2018-06-19,19 June 2018,IDC 2018 - Proceedings of the 2018 ACM Conference on Interaction Design and Children,,21100872716,,Conference Proceeding,,,,728-733,,,5,0,repositoryvor,Green,,,
176,2-s2.0-85050142935,10.1145/3211332.3211335,,,MakeCode and CODAL: Intuitive and efficient embedded systems programming for education,cp,Conference Paper,Devine J.,,Lancaster University,Lancaster,United Kingdom,,,,,2018-06-19,19 June 2018,"Proceedings of the ACM SIGPLAN Conference on Languages, Compilers, and Tools for Embedded Systems (LCTES)",,21100868865,,Conference Proceeding,,,,19-30,,,12,1,repositoryam,Green,,,
177,2-s2.0-85050129892,,,,"Proceedings of the ACM SIGPLAN Conference on Languages, Compilers, and Tools for Embedded Systems (LCTES)",cr,Conference Review,,,,,,,,,,2018-06-19,19 June 2018,"Proceedings of the ACM SIGPLAN Conference on Languages, Compilers, and Tools for Embedded Systems (LCTES)",,21100868865,,Conference Proceeding,,,,,,,0,0,,,,,
178,2-s2.0-85050097885,10.1145/3211332.3211336,,,Adaptive deep learning model selection on embedded systems,cp,Conference Paper,Taylor B.,,Lancaster University,Lancaster,United Kingdom,,,,,2018-06-19,19 June 2018,"Proceedings of the ACM SIGPLAN Conference on Languages, Compilers, and Tools for Embedded Systems (LCTES)",,21100868865,,Conference Proceeding,,,,31-43,,,25,0,repositoryam,Green,,,
179,2-s2.0-85050073733,10.1145/3211332.3211333,,,Deep neural networks compiler for a trace-Based accelerator (Short WIP paper),cp,Conference Paper,Chang A.,,FWDNXT,West Lafayette,United States,,,,,2018-06-19,19 June 2018,"Proceedings of the ACM SIGPLAN Conference on Languages, Compilers, and Tools for Embedded Systems (LCTES)",,21100868865,,Conference Proceeding,,,,89-93,,,0,0,,,,,
180,2-s2.0-85048681681,10.3389/fphys.2018.00680,,,The CoLoMoTo interactive notebook: Accessible and reproducible computational analyses for qualitative biological networks,ar,Article,Naldi A.,,École Normale Supérieure,Paris,France,,,,,2018-06-19,19 June 2018,Frontiers in Physiology,,21100215107,1664042X,Journal,9,JUN,680,,,,34,1,repositoryam,Green,,,
181,2-s2.0-85050569942,10.1145/3213512.3213517,,,Synthesis of fast and collision-free folding of polyhedral nets,cp,Conference Paper,Hao Y.,,George Mason University,Fairfax,United States,,,,,2018-06-17,17 June 2018,Proceedings - SCF 2018: ACM Symposium on Computational Fabrication,,21100870060,,Conference Proceeding,,,a2,,,,8,1,publisherfree2read,Bronze,,,
182,2-s2.0-85056638537,10.1145/3239576.3239624,,,Implementation of a self-balancing robot using Lego EV3 robotic Kit and EV3Dev,cp,Conference Paper,Mikaiel A.,,Middle Tennessee State University,Murfreesboro,United States,,,,,2018-06-16,16 June 2018,ACM International Conference Proceeding Series,,11600154611,,Conference Proceeding,,,,154-158,,,1,0,,,,,
183,2-s2.0-85035079318,10.1016/j.eswa.2017.11.011,S0957417417307613,,Towards a common implementation of reinforcement learning for multiple robotic tasks,ar,Article,Martínez-Tenor A.,,Instituto de Investigación Biomédica de Málaga,Malaga,Spain,,,,,2018-06-15,15 June 2018,Expert Systems with Applications,09574174,24201,,Journal,100,,,246-259,,,23,0,repositoryam,Green,,,
184,2-s2.0-85049864742,10.1145/3209087.3209093,,,Robot tutoring: On the feasibility of using cognitive systems as tutors in introductory programming education: A teaching experiment,cp,Conference Paper,Müller S.,,Fachhochschule Münster - Abteilung Steinfurt,Steinfurt,Germany,,,,,2018-06-14,14 June 2018,ACM International Conference Proceeding Series,,11600154611,,Conference Proceeding,,,,45-49,,,9,1,publisherfree2read,Bronze,,,
185,2-s2.0-85053370902,10.7652/xjtuxb201806006,,,A Deep Learning Frame on Embedded Multicore Processors Based on Caffe and Its Parallel Implementation,ar,Article,Gao R.,,Xi'an Jiaotong University,Xi'an,China,,,,,2018-06-10,10 June 2018,Hsi-An Chiao Tung Ta Hsueh/Journal of Xi'an Jiaotong University,0253987X,26196,,Journal,52,6,,,,,0,0,,,,,
186,2-s2.0-85055455675,,,,Proceedings - International Computer Software and Applications Conference,cr,Conference Review,,,,,,,,,,2018-06-08,8 June 2018,Proceedings - International Computer Software and Applications Conference,07303157,18705,,Conference Proceeding,1,,,,,,0,0,,,,,
187,2-s2.0-85049917716,10.1109/SIMPAR.2018.8376279,,,Investigating heterogeneous planning spaces,cp,Conference Paper,Upadhyay A.,,Texas A&amp;M University,College Station,United States,,,,,2018-06-08,8 June 2018,"2018 IEEE International Conference on Simulation, Modeling, and Programming for Autonomous Robots, SIMPAR 2018",,21100868215,,Conference Proceeding,,,,108-115,,,4,0,,,,,
188,2-s2.0-85049884848,10.1109/SIMPAR.2018.8376264,,,DoShiCo challenge: Domain shift in control prediction,cp,Conference Paper,Kelchtermans K.,,KU Leuven,3000 Leuven,Belgium,,,,,2018-06-08,8 June 2018,"2018 IEEE International Conference on Simulation, Modeling, and Programming for Autonomous Robots, SIMPAR 2018",,21100868215,,Conference Proceeding,,,,8-14,,,0,0,repositoryam,Green,,,
189,2-s2.0-85049875892,,,,"2018 IEEE International Conference on Simulation, Modeling, and Programming for Autonomous Robots, SIMPAR 2018",cr,Conference Review,,,,,,,,,,2018-06-08,8 June 2018,"2018 IEEE International Conference on Simulation, Modeling, and Programming for Autonomous Robots, SIMPAR 2018",,21100868215,,Conference Proceeding,,,,,,,0,0,,,,,
190,2-s2.0-85067859159,,,,"Educational robotics to develop executive functions visual spatial abilities, planning and problem solving.",ar,Article,LA PAGLIA F.,,Università degli Studi di Palermo,Palermo,Italy,,,,,2018-06-01,Summer 2018,Annual Review of CyberTherapy and Telemedicine,15548716,19700174668,,Journal,2018,16,,80-86,,,5,0,,,,,
191,2-s2.0-85060735489,10.1049/trit.2018.0016,,,Visual programming language environment for different IoT and robotics platforms in computer science education,ar,Article,de Luca G.,,"School of Computing, Informatics, and Decision Systems Engineering",Tempe,United States,,,,,2018-06-01,1 June 2018,CAAI Transactions on Intelligence Technology,24686557,21100970248,24682322,Journal,3,2,,119-130,,,15,1,publisherfullgold,Gold,,,
192,2-s2.0-85049219296,10.1142/S0218213018600059,,,Motion Planning with Energy Reduction for a Floating Robotic Platform under Disturbances and Measurement Noise Using Reinforcement Learning,ar,Article,Tziortziotis K.,,University of Ioannina,Ioannina,Greece,,,,,2018-06-01,1 June 2018,International Journal on Artificial Intelligence Tools,02182130,4700152645,17936349,Journal,27,4,1860005,,,,1,0,,,,,
193,2-s2.0-85048695184,10.1007/s12369-017-0454-3,,,Between the Social and the Technical: Negotiation of Human-Centered Robotics Design in a Middle School Classroom,ar,Article,Gomoll A.,,Indiana University School of Education,Bloomington,United States,,,,,2018-06-01,1 June 2018,International Journal of Social Robotics,18754791,19500157063,18754805,Journal,10,3,,309-324,,,16,0,,,,,
194,2-s2.0-85048668271,10.1109/TCDS.2017.2655539,,,Adaptive robot path planning using a spiking neuron algorithm with axonal delays,ar,Article,Hwu T.,,"Northrop Grumman corporation;University of California, Irvine",Los Angeles;Irvine,United States;United States,,,,,2018-06-01,June 2018,IEEE Transactions on Cognitive and Developmental Systems,23798920,21100784665,23798939,Journal,10,2,,126-137,,,34,1,publisherfree2read,Bronze,,,
195,2-s2.0-85010748070,10.1007/s10798-017-9397-0,,,"Dancing robots: integrating art, music, and robotics in Singapore’s early childhood centers",ar,Article,Sullivan A.,,Tufts University,Medford,United States,,,,,2018-06-01,1 June 2018,International Journal of Technology and Design Education,09577572,21389,15731804,Journal,28,2,,325-346,,,80,0,,,,,
196,2-s2.0-85048863337,10.23919/SMAGRIMET.2018.8369850,,,Towards statistical machine learning for edge analytics in large scale networks: Real-time Gaussian function generation with generic DSP,cp,Conference Paper,Oyekanlu E.,,Drexel University,Philadelphia,United States,,,,,2018-05-30,30 May 2018,"2018 1st International Colloquium on Smart Grid Metrology, SmaGriMet 2018",,21100865379,,Conference Proceeding,,,,1-6,,,5,0,,,,,
197,2-s2.0-85054153135,10.1145/3207719.3207727,,,Less is more: Exploiting the standard compiler optimization levels for better performance and energy consumption,cp,Conference Paper,Georgiou K.,,University of Bristol,Bristol,United Kingdom,,,,,2018-05-28,28 May 2018,"Proceedings of the 21st International Workshop on Software and Compilers for Embedded Systems, SCOPES 2018",,21100878871,,Conference Proceeding,,,,35-42,,,9,0,repositoryam,Green,,,
