,eid,doi,pii,pubmed_id,title,subtype,subtypeDescription,creator,afid,affilname,affiliation_city,affiliation_country,author_count,author_names,author_ids,author_afids,coverDate,coverDisplayDate,publicationName,issn,source_id,eIssn,aggregationType,volume,issueIdentifier,article_number,pageRange,description,authkeywords,citedby_count,openaccess,freetoread,freetoreadLabel,fund_acr,fund_no,fund_sponsor
265,2-s2.0-85023600688,10.1109/TE.2017.2721907,,,A Multidisciplinary PBL Approach for Teaching Industrial Informatics and Robotics in Engineering,ar,Article,Calvo I.,,Universidad del Pais Vasco,Leioa,Spain,,,,,2018-02-01,February 2018,IEEE Transactions on Education,00189359,17344,,Journal,61,1,7976355,21-28,,,44,0,,,,,
266,2-s2.0-85019620537,10.1016/j.neucom.2017.05.015,S0925231217308238,,Automatic illumination planning for robot vision inspection system,ar,Article,Wang H.,,MOE Key Laboratory of System Control and Information Processing,Shanghai,China,,,,,2018-01-31,31 January 2018,Neurocomputing,09252312,24807,18728286,Journal,275,,,19-28,,,18,0,,,,,
267,2-s2.0-85047361966,10.1109/CCAC.2017.8276396,,,A review of intuitive robot programming environments for educational purposes,cp,Conference Paper,Bravo F.,,Pontificia Universidad Javeriana,Bogota,Colombia,,,,,2018-01-30,30 January 2018,"2017 IEEE 3rd Colombian Conference on Automatic Control, CCAC 2017 - Conference Proceedings",,21100861053,,Conference Proceeding,2018-January,,,1-6,,,11,0,,,,,
268,2-s2.0-85046899882,10.1145/3174781.3174788,,,"Courses, content, and tools for internet of things in computer science education",cp,Conference Paper,Burd B.,,Drew University,Madison,United States,,,,,2018-01-30,30 January 2018,ITiCSE-WGR 2017 - Proceedings of the 2017 ITiCSE Conference on Working Group Reports,,21100860208,,Conference Proceeding,2018-January,,,125-139,,,38,0,,,,,
269,2-s2.0-85050735635,10.1109/ICARM.2017.8273233,,,Autonomous exploration for mobile robot using Q-learning,cp,Conference Paper,Liu Y.,,Hebei University of Technology,Tianjin,China,,,,,2018-01-29,29 January 2018,"2017 2nd International Conference on Advanced Robotics and Mechatronics, ICARM 2017",,21100870574,,Conference Proceeding,2018-January,,,614-619,,,7,0,,,,,
270,2-s2.0-85050721744,10.1109/ICARM.2017.8273235,,,A deep Q network for robotic planning from image,cp,Conference Paper,Han J.,,Hebei University of Technology,Tianjin,China,,,,,2018-01-29,29 January 2018,"2017 2nd International Conference on Advanced Robotics and Mechatronics, ICARM 2017",,21100870574,,Conference Proceeding,2018-January,,,626-631,,,1,0,,,,,
271,2-s2.0-85049226311,10.1109/ICCIS.2017.8274867,,,Development of a virtual teaching pendant system for serial robots based on ROS-I,cp,Conference Paper,Chen L.,,Xi'an Jiaotong University,Xi'an,China,,,,,2018-01-29,29 January 2018,"2017 IEEE International Conference on Cybernetics and Intelligent Systems, CIS 2017 and IEEE Conference on Robotics, Automation and Mechatronics, RAM 2017 - Proceedings",,21100866195,,Conference Proceeding,2018-January,,,720-724,,,6,0,,,,,
272,2-s2.0-85041693756,10.1088/1757-899X/288/1/012086,,,Application of Desktop-Based Batik Information System,cp,Conference Paper,Widiaty I.,,Universitas Pendidikan Indonesia,Bandung,Indonesia,,,,,2018-01-25,25 January 2018,IOP Conference Series: Materials Science and Engineering,17578981,19700200831,1757899X,Conference Proceeding,288,1,012086,,,,3,1,publisherfree2read,Bronze,,,
273,2-s2.0-85045380825,10.1145/3183767.3183768,,,HyperLoom: A platform for defining and executing scientific pipelines in distributed environments,cp,Conference Paper,Cima V.,,IT4Innovations,Ostrava,Czech Republic,,,,,2018-01-23,23 January 2018,ACM International Conference Proceeding Series,,11600154611,,Conference Proceeding,,,,1-6,,,9,0,repositoryam,Green,,,
274,2-s2.0-85046288923,10.1109/CDC.2017.8264271,,,Temporal task planning in wirelessly connected environments with unknown channel quality,cp,Conference Paper,Guo M.,,Duke University,Durham,United States,,,,,2018-01-18,18 January 2018,"2017 IEEE 56th Annual Conference on Decision and Control, CDC 2017",,21100858478,,Conference Proceeding,2018-January,,,4161-4168,,,0,0,,,,,
275,2-s2.0-85050199896,,,,"2017 International Symposium on Computers in Education, SIIE 2017",cr,Conference Review,,,,,,,,,,2018-01-16,16 January 2018,"2017 International Symposium on Computers in Education, SIIE 2017",,21100869169,,Conference Proceeding,2018-January,,,,,,0,0,,,,,
276,2-s2.0-85044927878,10.1109/COASE.2017.8256120,,,Robot programming for manipulators through volume sweeping and augmented reality,cp,Conference Paper,Sarai Y.,,Yokohama National University,Yokohama,Japan,,,,,2018-01-12,12 January 2018,IEEE International Conference on Automation Science and Engineering,21618070,20500195424,21618089,Conference Proceeding,2017-August,,,302-307,,,6,0,,,,,
277,2-s2.0-85040995337,10.1080/16864360.2017.1419642,,,Using collaborative robots to assist with travel path development for material deposition based additive manufacturing processes,ar,Article,Djuric A.,,Wayne State University,Detroit,United States,,,,,2018-01-10,10 January 2018,Computer-Aided Design and Applications,16864360,4700151607,,Journal,15,4,,542-555,,,6,1,publisherfree2read,Bronze,,,
278,2-s2.0-85135384197,,,,A Gender-Sensitive Curriculum for Learning and Teaching Programing at Primary School,cp,Conference Paper,Bockermann I.,,Universität Bremen,Bremen,Germany,,,,,2018-01-01,2018,"Proceedings of the IDC Workshop: Sustaining Girls' Participation in STEM, Gaming and Making 2018",,21101099973,,Conference Proceeding,,,,,,,0,0,,,,,
279,2-s2.0-85122846839,10.4108/eai.19-6-2018.154825,,,Open Source Based Peripherals for Automotive Electronic Control Unit,ar,Article,Pančík J.,,AMBIS,Prague,Czech Republic,,,,,2018-01-01,2018,EAI Endorsed Transactions on Scalable Information Systems,,21101072199,20329407,Journal,5,18,e2,1-7,,,0,1,repositoryam,Green,,,
280,2-s2.0-85122024352,10.29333/ejmste/93483,,,Skill Development and Knowledge Acquisition Cultivated by Maker Education: Evidence from Arduino-based Educational Robotics,ar,Article,Chou P.N.,,National University of Tainan Taiwan,Tainan,Taiwan,,,,,2018-01-01,2018,"Eurasia Journal of Mathematics, Science and Technology Education",13058215,4400151729,13058223,Journal,14,10,,1-15,,,31,1,publisherfree2read,Bronze,,,
281,2-s2.0-85103853115,,,,Cross comparison of multiple computational thinking activities: A grey-based approach,cp,Conference Paper,How M.L.,,National Institute of Education,Singapore City,Singapore,,,,,2018-01-01,2018,Proceedings of International Conference on Computational Thinking Education,,21101023397,26645661,Conference Proceeding,,,,125-128,,,0,0,,,,,
282,2-s2.0-85102573295,,,,Teaching virtual agents to perform complex spatial-temporal activities,cp,Conference Paper,Do T.,,Brandeis University,Waltham,United States,,,,,2018-01-01,2018,AAAI Spring Symposium - Technical Report,,21101039865,,Conference Proceeding,2018-March,,,525-531,,,1,0,,,,,
283,2-s2.0-85092692141,10.1007/978-3-319-67361-5_16,,,Online Multi-modal Learning and Adaptive Informative Trajectory Planning for Autonomous Exploration,ch,Book Chapter,Arora A.,,The University of Sydney,Sydney,Australia,,,,,2018-01-01,2018,Springer Proceedings in Advanced Robotics,25111256,21101047137,25111264,Conference Proceeding,5,,,239-254,,,2,0,,,,,
284,2-s2.0-85090368237,10.1007/978-3-319-70688-7_12,,,Security stipulations on iot networks,ch,Book Chapter,Sundar S.,,Vellore Institute of Technology,Vellore,India,,,,,2018-01-01,2018,Lecture Notes on Data Engineering and Communications Technologies,23674512,21100975545,23674520,Book Series,14,,,289-306,,,1,0,,,,,
285,2-s2.0-85089245954,,,,"Understanding students' intentions in learning visual robotic programming: An integration of IS success model, utilitarian value and hedonic value",cp,Conference Paper,Chien S.Y.,,National Sun Yat-Sen University,Kaohsiung,Taiwan,,,,,2018-01-01,2018,"Proceedings of the 22nd Pacific Asia Conference on Information Systems - Opportunities and Challenges for the Digitized Society: Are We Ready?, PACIS 2018",,21101019358,,Conference Proceeding,,,,,,,0,0,,,,,
286,2-s2.0-85083951068,,,,DLVM: A modern compiler infrastructure for deep learning systems,cp,Conference Paper,Wei R.,,University of Illinois Urbana-Champaign,Urbana,United States,,,,,2018-01-01,2018,"6th International Conference on Learning Representations, ICLR 2018 - Workshop Track Proceedings",,21100924815,,Conference Proceeding,,,,,,,8,0,,,,,
287,2-s2.0-85081610647,,,,Funken Serial Protocol Toolkit for Interactive Prototyping,cp,Conference Paper,Stefas A.,,Technische Universität Darmstadt,Darmstadt,Germany,,,,,2018-01-01,2018,Proceedings of the International Conference on Education and Research in Computer Aided Architectural Design in Europe,26841843,21101075992,,Conference Proceeding,2,,,177-186,,,1,0,,,,,
288,2-s2.0-85073059780,10.1142/9789813231047_0024,,,Elementary students programming in C to make their robots do their bidding,cp,Conference Paper,Miller D.P.,,University of Oklahoma;KISS Institute for Practical Robotics,Norman;Norman,United States;United States,,,,,2018-01-01,2018,"Human-Centric Robotics- Proceedings of the 20th International Conference on Climbing and Walking Robots and the Support Technologies for Mobile Machines, CLAWAR 2017",,21100931374,,Conference Proceeding,,,,179-185,,,0,0,,,,,
289,2-s2.0-85071500345,10.5220/0006872306000604,,,LoggerBit: An optimization of the OpenLog board for data logging with low cost hardware platforms for biomedical applications,cp,Conference Paper,Reis M.,,Instituto Superior Técnico,Lisbon,Portugal,,,,,2018-01-01,2018,"ICINCO 2018 - Proceedings of the 15th International Conference on Informatics in Control, Automation and Robotics",,21100926516,,Conference Proceeding,2,,,600-604,,,1,0,,,,,
290,2-s2.0-85071193719,10.15607/RSS.2018.XIV.048,,,Simplifying Reward Design through Divide-and-Conquer,cp,Conference Paper,Ratner E.,,,,,,,,,2018-01-01,2018,Robotics: Science and Systems,,21100448299,2330765X,Conference Proceeding,,,,,,,5,1,repositoryam,Green,,,
291,2-s2.0-85070861209,,,,Rotating machines system identification by means of big data analysis,cp,Conference Paper,Gioia N.,,Vrije Universiteit Brussel,Brussels,Belgium,,,,,2018-01-01,2018,"9th European Workshop on Structural Health Monitoring, EWSHM 2018",,21100924724,,Conference Proceeding,,,,,,,1,0,,,,,
292,2-s2.0-85070701027,10.18429/JACoW-PCaPAC2018-WEP07,,,Innovative graphical user interfaces development: Give the power back to users,cp,Conference Paper,Millan G.S.,,European Organization for Nuclear Research,Geneva,Switzerland,,,,,2018-01-01,2018,"Proceedings of the 12th International Workshop on Emerging Technologies and Scientific Facilities Controls, PCaPAC 2018",,21100924162,,Conference Proceeding,,,,44-46,,,0,0,,,,,
293,2-s2.0-85066503549,10.2514/6.2018-4621,,,An embedded hardware-in-the-loop testbed for aeroengine simulation education,cp,Conference Paper,Ji W.,,Beihang University;Collaborative Innovation Center of Advanced Aero-Engine,Beijing;Beijing,China;China,,,,,2018-01-01,2018,2018 Joint Propulsion Conference,,21100908500,,Conference Proceeding,,,AIAA 2018-4621,,,,2,0,,,,,
294,2-s2.0-85065337795,,,,"Challenges in the definition, validation and simulation of the ground operations of the ExoMars 2020 rover surface mission at the rover operations control centre (ROCC)",cp,Conference Paper,Bussi D.,,Altec S.p.A.,Turin,Italy,,,,,2018-01-01,2018,"Proceedings of the International Astronautical Congress, IAC",00741795,21100255701,,Conference Proceeding,2018-October,,,,,,3,0,,,,,
295,2-s2.0-85065328920,,,,The ERGO framework and its use in planetary/orbital scenarios,cp,Conference Paper,OcÃ³n J.,,GMV S.A.,Tres Cantos,Spain,,,,,2018-01-01,2018,"Proceedings of the International Astronautical Congress, IAC",00741795,21100255701,,Conference Proceeding,2018-October,,,,,,6,0,,,,,
296,2-s2.0-85065311566,,,,"Hands-on education and student research at TU Berlin: Satellites, Rovers, Rockets and Space System Experiments developed by students in an international environment",cp,Conference Paper,Buscher M.,,Technische Universität Berlin,Berlin,Germany,,,,,2018-01-01,2018,"Proceedings of the International Astronautical Congress, IAC",00741795,21100255701,,Conference Proceeding,2018-October,,,,,,0,0,,,,,
297,2-s2.0-85064822982,,,,Learning convex bounds for linear quadratic control policy synthesis,cp,Conference Paper,Umenberger J.,,Uppsala Universitet,Uppsala,Sweden,,,,,2018-01-01,2018,Advances in Neural Information Processing Systems,10495258,23669,,Conference Proceeding,2018-December,,,9561-9572,,,6,0,,,,,
298,2-s2.0-85064569645,10.1007/978-1-4842-4218-6,,,"Practical quantum computing for developers: Programming quantum rigs in the cloud using Python, quantum assembly language and IBM Qexperience",bk,Book,Silva V.,,,,,,,,,2018-01-01,1 January 2018,"Practical Quantum Computing for Developers: Programming Quantum Rigs in the Cloud using Python, Quantum Assembly Language and IBM QExperience",,21100903880,,Book,,,,1-346,,,9,0,repositoryvor,Green,,,
299,2-s2.0-85063547871,10.1007/978-3-319-64352-6_33,,,Learning to program in K12 using a remote controlled robot: RoboBlock,ch,Book Chapter,García-Zubía J.,,Universidad de Deusto,Bilbao,Spain,,,,,2018-01-01,2018,Lecture Notes in Networks and Systems,23673370,21100901469,23673389,Book Series,22,,,344-358,,,5,0,,,,,
300,2-s2.0-85062712372,10.23919/ChiCC.2018.8484186,,,On Local Path Planning for the Mobile Robot based on QL Algorithm,cp,Conference Paper,Song L.,,Shandong University of Technology,Zibo,China,,,,,2018-01-01,2018,"Chinese Control Conference, CCC",19341768,21100228702,21612927,Conference Proceeding,2018-January,,8484186,5293-5298,,,1,0,,,,,
301,2-s2.0-85062663179,,,,CEUR Workshop Proceedings,cr,Conference Review,,,,,,,,,,2018-01-01,2018,CEUR Workshop Proceedings,16130073,21100218356,,Conference Proceeding,2325,,,,,,0,0,,,,,
302,2-s2.0-85062662049,10.26583/sv.10.5.05,,,The image analysis of the geometric bodies with supplemental interactive block for training new knowledge in a limited natural language,ar,Article,Volchenkov N.,,National Research Nuclear University MEPhI,Moscow,Russian Federation,,,,,2018-01-01,2018,Scientific Visualization,,21100244604,20793537,Journal,10,5,,57-85,,,0,0,,,,,
303,2-s2.0-85062363818,10.1007/978-3-319-93566-9_2,,,Characteristics of studies conducted on computational thinking: A content analysis,ch,Book Chapter,Kalelioğlu F.,,Başkent Üniversitesi,Ankara,Turkey,,,,,2018-01-01,1 January 2018,Computational Thinking in the STEM Disciplines: Foundations and Research Highlights,,21100902245,,Book,,,,11-29,,,12,0,,,,,
304,2-s2.0-85062261584,10.15607/RSS.2018.XIV.038,,,Analytical Derivatives of Rigid Body Dynamics Algorithms,cp,Conference Paper,Carpentier J.,,Université Fédérale Toulouse Midi-Pyrénées,Toulouse,France,,,,,2018-01-01,2018,Robotics: Science and Systems,,21100448299,2330765X,Conference Proceeding,,,,,,,61,1,repositoryam,Green,,,
305,2-s2.0-85062181684,,,,Asymmetry regional boundary localization for indoor robot navigation,cp,Conference Paper,Wanadecha N.,,King Mongkut's Institute of Technology Ladkrabang,Ladkrabang Bangkok,Thailand,,,,,2018-01-01,2018,Lecture Notes in Engineering and Computer Science,20780958,21100218002,,Conference Proceeding,2238,,,568-573,,,0,0,,,,,
306,2-s2.0-85061994145,10.1016/j.procs.2018.10.331,S1877050918320040,,Benchmarking supervised learning frameworks for engineering highly scalable intelligent systems,cp,Conference Paper,Narayan O.,,NYU Tandon School of Engineering,New York,United States,,,,,2018-01-01,2018,Procedia Computer Science,,19700182801,18770509,Conference Proceeding,140,,,216-222,,,0,1,publisherfullgold,Gold,,,
307,2-s2.0-85061979818,10.1016/j.procs.2018.10.307,S187705091831980X,,Using accuracy measure for improving the training of LSTM with metaheuristic algorithms,cp,Conference Paper,Rashid T.A.,,University of Kurdistan Hewlêr;Salahaddin University-Erbil,Erbil;Erbil,Iraq;Iraq,,,,,2018-01-01,2018,Procedia Computer Science,,19700182801,18770509,Conference Proceeding,140,,,324-333,,,23,1,publisherfullgold,Gold,,,
308,2-s2.0-85061975291,10.1016/j.procir.2018.01.036,S2212827118300507,,"Intuitive robot programming through environment perception, augmented reality simulation and automated program verification",cp,Conference Paper,Wassermann J.,,Technische Universität Berlin,Berlin,Germany,,,,,2018-01-01,2018,Procedia CIRP,22128271,21100243809,,Conference Proceeding,76,,,161-166,,,11,1,publisherfullgold,Gold,,,
309,2-s2.0-85061964891,10.1016/j.procir.2018.02.010,S2212827118300295,,A machine learning-enhanced digital twin approach for human-robot-collaboration,cp,Conference Paper,Dröder K.,,Technische Universität Braunschweig,Braunschweig,Germany,,,,,2018-01-01,2018,Procedia CIRP,22128271,21100243809,,Conference Proceeding,76,,,187-192,,,57,1,publisherfullgold,Gold,,,
310,2-s2.0-85061170184,10.1016/j.procir.2018.01.021,S2212827118300350,,Industrial robot control with object recognition based on deep learning,cp,Conference Paper,Chen X.,,Fraunhofer Institute for Manufacturing Engineering and Automation IPA,Stuttgart,Germany,,,,,2018-01-01,2018,Procedia CIRP,22128271,21100243809,,Conference Proceeding,76,,,149-154,,,26,1,repositoryam,Green,,,
311,2-s2.0-85060458170,10.1007/978-3-030-01057-7_22,,,Bivariate markov model based analysis of ecg for accurate identification and classification of premature heartbeats and irregular beat-patterns,cp,Conference Paper,Gawde P.R.,,Kent State University,Kent,United States,,,,,2018-01-01,2018,Advances in Intelligent Systems and Computing,21945357,5100152904,,Book Series,869,,,265-285,,,0,0,,,,,
312,2-s2.0-85060403330,10.1115/IMECE2018-86720,,,Adaptive industrial robots using machine vision,cp,Conference Paper,Kuts V.,,Tallinna Tehnikaülikool,Tallinn,Estonia,,,,,2018-01-01,2018,"ASME International Mechanical Engineering Congress and Exposition, Proceedings (IMECE)",,21100896103,,Conference Proceeding,2,,,,,,23,0,,,,,
313,2-s2.0-85060295290,10.1115/IMECE2018-87776,,,Assessment of three dimensional CAD models using CAD application programming interface,cp,Conference Paper,Joo S.,,Grand Valley State University,Allendale,United States,,,,,2018-01-01,2018,"ASME International Mechanical Engineering Congress and Exposition, Proceedings (IMECE)",,21100821106,,Conference Proceeding,5,,,,,,3,0,,,,,
314,2-s2.0-85060097800,,,,Personalization of gamification in (programming) e-learning environments,cp,Conference Paper,Zaric N.,,Rheinisch-Westfälische Technische Hochschule Aachen,Aachen,Germany,,,,,2018-01-01,2018,CEUR Workshop Proceedings,16130073,21100218356,,Conference Proceeding,2294,,,,,,0,0,,,,,
315,2-s2.0-85060089453,,,,The ATLAS production system predictive analytics service: An approach for intelligent task analysis,cp,Conference Paper,Titov M.,,"National Research Centre ""Kurchatov Institute""",Moscow,Russian Federation,,,,,2018-01-01,2018,CEUR Workshop Proceedings,16130073,21100218356,,Conference Proceeding,2267,,,124-128,,,1,0,,,,,
316,2-s2.0-85059699074,10.1007/978-3-030-02750-6_12,,,Comparative analysis of the content of school course of informatics in Russia and subjects of the international competition Bebras,cp,Conference Paper,Bosova L.,,Moscow Pedagogical State University,Moscow,Russian Federation,,,,,2018-01-01,2018,Lecture Notes in Computer Science (including subseries Lecture Notes in Artificial Intelligence and Lecture Notes in Bioinformatics),03029743,25674,16113349,Book Series,11169 LNCS,,,154-164,,,0,0,,,,,
317,2-s2.0-85059684355,10.1007/978-3-030-02750-6_27,,,How an ambitious informatics curriculum can influence algebraic thinking of primary school children,cp,Conference Paper,Agatolio F.,,Università degli Studi di Padova,Padua,Italy,,,,,2018-01-01,2018,Lecture Notes in Computer Science (including subseries Lecture Notes in Artificial Intelligence and Lecture Notes in Bioinformatics),03029743,25674,16113349,Book Series,11169 LNCS,,,354-365,,,0,0,repositoryam,Green,,,
318,2-s2.0-85059448921,10.11591/ijece.v8i2.pp1230-1237,,,Tool use learning for a real robot,ar,Article,Wicaksono H.,,Universitas Kristen Petra;UNSW Sydney,"Surabaya, East Java;Sydney",Indonesia;Australia,,,,,2018-01-01,2018,International Journal of Electrical and Computer Engineering,20888708,21100373959,,Journal,8,2,,1230-1237,,,4,1,repositoryvor,Green,,,
319,2-s2.0-85059378759,,,,A Virtual Robot to support Programming Learning,cp,Conference Paper,Aparicio J.T.,,Iscte – Instituto Universitário de Lisboa,Lisbon,Portugal,,,,,2018-01-01,2018,"50th International Symposium on Robotics, ISR 2018",,21100893624,,Conference Proceeding,,,,139-142,,,1,0,,,,,
320,2-s2.0-85059368865,,,,Framework for automated program generation of HRC applications,cp,Conference Paper,Müller F.,,Technische Hochschule Nürnberg,Nurnberg,Germany,,,,,2018-01-01,2018,"50th International Symposium on Robotics, ISR 2018",,21100893624,,Conference Proceeding,,,,434-441,,,2,0,,,,,
321,2-s2.0-85059036792,10.1007/978-3-030-04239-4_27,,,Multi-feature Fusion for Deep Reinforcement Learning: Sequential Control of Mobile Robots,cp,Conference Paper,Wang H.,,National University of Defense Technology China,Changsha,China,,,,,2018-01-01,2018,Lecture Notes in Computer Science (including subseries Lecture Notes in Artificial Intelligence and Lecture Notes in Bioinformatics),03029743,25674,16113349,Book Series,11307 LNCS,,,303-315,,,2,0,,,,,
322,2-s2.0-85059030530,10.1007/978-3-030-04239-4_13,,,Robot Navigation on Slow Feature Gradients,cp,Conference Paper,Haris M.,,Honda Research Institute Europe GmbH,Offenbach,Germany,,,,,2018-01-01,2018,Lecture Notes in Computer Science (including subseries Lecture Notes in Artificial Intelligence and Lecture Notes in Bioinformatics),03029743,25674,16113349,Book Series,11307 LNCS,,,143-154,,,2,0,,,,,
323,2-s2.0-85058875131,10.14778/3236187.3236194,,,AIDA - Abstraction for advanced in database analytics,cp,Conference Paper,D'silva J.V.,,Université McGill,Montreal,Canada,,,,,2018-01-01,2018,Proceedings of the VLDB Endowment,,21100199855,21508097,Journal,11,11,,1400-1413,,,20,0,,,,,
324,2-s2.0-85058320033,10.3389/frobt.2018.00110,,,Stage-wise learning of reaching using little prior knowledge,ar,Article,de La Bourdonnaye F.L.,,CNRS Centre National de la Recherche Scientifique,Paris,France,,,,,2018-01-01,2018,Frontiers Robotics AI,,21100868821,22969144,Journal,5,OCT,110,,,,3,1,repositoryam,Green,,,
325,2-s2.0-85058282111,10.1007/978-3-030-05204-1_49,,,Perception of control in artificial and human systems: A study of embodied performance interactions,cp,Conference Paper,Cuan C.,,University of Illinois Urbana-Champaign,Urbana,United States,,,,,2018-01-01,2018,Lecture Notes in Computer Science (including subseries Lecture Notes in Artificial Intelligence and Lecture Notes in Bioinformatics),03029743,25674,16113349,Book Series,11357 LNAI,,,503-512,,,5,0,,,,,
326,2-s2.0-85057981214,10.3233/978-1-61499-898-3-281,,,Deep learning-based method for vision-guided robotic grasping of unknown objects,cp,Conference Paper,Bergamini L.,,Università degli Studi di Modena e Reggio Emilia,Modena,Italy,,,,,2018-01-01,2018,Advances in Transdisciplinary Engineering,,21100496836,,Conference Proceeding,7,,,281-290,,,4,0,,,,,
327,2-s2.0-85057779043,10.1109/ACCESS.2018.2883504,,,Optimal PI<sup>λ</sup> D<sup>μ</sup> controller design for two wheeled inverted pendulum,ar,Article,Erkol H.,,Karabük Üniversitesi,Karabuk,Turkey,,,,,2018-01-01,2018,IEEE Access,,21100374601,21693536,Journal,6,,8548547,75709-75717,,,20,1,publisherfullgold,Gold,,,
328,2-s2.0-85057435037,,,,"17th Conference of the Italian Association for Artificial Intelligence, AIIA 2018",cr,Conference Review,,,,,,,,,,2018-01-01,2018,Lecture Notes in Computer Science (including subseries Lecture Notes in Artificial Intelligence and Lecture Notes in Bioinformatics),03029743,25674,16113349,Book Series,11298 LNAI,,,,,,0,0,,,,,
329,2-s2.0-85057402217,10.3233/978-1-61499-902-7-163,,,On transferring crafting intentions from humans to robots: A message to manufacturers of the (near) future,cp,Conference Paper,Montebelli A.,,Högskolan i Skövde,Skovde,Sweden,,,,,2018-01-01,2018,Advances in Transdisciplinary Engineering,,21100496836,,Conference Proceeding,8,,,163-168,,,0,0,,,,,
330,2-s2.0-85057190562,,,,Finding balance in generative product design,cp,Conference Paper,Lobos A.,,Rochester Institute of Technology,Rochester,United States,,,,,2018-01-01,2018,"Proceedings of NordDesign: Design in the Era of Digitalization, NordDesign 2018",,21100887609,,Conference Proceeding,,,,,,,1,0,,,,,
331,2-s2.0-85057189926,10.1109/ACCESS.2018.2882875,,,RL and ANN based modular path planning controller for resource-constrained robots in the indoor complex dynamic environment,ar,Article,Ullah Z.,,Institute of Computing Technology Chinese Academy of Sciences;University of Chinese Academy of Sciences,Beijing;Beijing,China;China,,,,,2018-01-01,2018,IEEE Access,,21100374601,21693536,Journal,6,,8543176,74557-74568,,,7,1,publisherfullgold,Gold,,,
332,2-s2.0-85057118873,10.1007/978-3-030-01054-6_54,,,Learning by demonstration with baxter humanoid,cp,Conference Paper,Al-Abdulqader O.,,University of Essex,Colchester,United Kingdom,,,,,2018-01-01,2018,Advances in Intelligent Systems and Computing,21945357,5100152904,21945365,Book Series,868,,,770-790,,,2,0,,,,,
333,2-s2.0-85057037476,10.1016/j.ifacol.2018.11.271,S2405896318329446,,Transportation of small objects by robotic throwing and catching: applying genetic programming for trajectory estimation,cp,Conference Paper,Gayanov R.,,Ufa State Aviation Technical University,Ufa,Russian Federation,,,,,2018-01-01,2018,IFAC-PapersOnLine,,21100456158,24058963,Conference Proceeding,51,30,,533-537,,,6,1,repositoryvor,Green,,,
