,eid,doi,pii,pubmed_id,title,subtype,subtypeDescription,creator,afid,affilname,affiliation_city,affiliation_country,author_count,author_names,author_ids,author_afids,coverDate,coverDisplayDate,publicationName,issn,source_id,eIssn,aggregationType,volume,issueIdentifier,article_number,pageRange,description,authkeywords,citedby_count,openaccess,freetoread,freetoreadLabel,fund_acr,fund_no,fund_sponsor
199,2-s2.0-84964478552,10.1109/ROBIO.2015.7419021,,,An intuitive teaching system using sensor fusion and 3D matching,cp,Conference Paper,Zhao H.,,"Ningbo Institute of Industrial Technology, Chinese Academy of Sciences",Ningbo,China,,,,,2015-01-01,2015,"2015 IEEE International Conference on Robotics and Biomimetics, IEEE-ROBIO 2015",,21100824859,,Conference Proceeding,,,7419021,1729-1734,,,1,0,,,,,
200,2-s2.0-84964474549,10.1109/ROBIO.2015.7418905,,,Education-oriented portable brain-controlled robot system,cp,Conference Paper,Zhi D.,,Tianjin University,Tianjin,China,,,,,2015-01-01,2015,"2015 IEEE International Conference on Robotics and Biomimetics, IEEE-ROBIO 2015",,21100824859,,Conference Proceeding,,,7418905,1018-1023,,,3,0,,,,,
201,2-s2.0-84964294719,10.1016/j.ifacol.2015.11.211,S2405896315024696,,Python based internet tools in control education,cp,Conference Paper,Vergnaud A.,,Université d’Angers,Angers,France,,,,,2015-01-01,2015,IFAC-PapersOnLine,,21100456158,24058963,Conference Proceeding,48,29,,43-48,,,6,1,publisherfree2read,Bronze,,,
202,2-s2.0-84964265093,10.1016/j.ifacol.2015.12.035,S2405896315026592,,Development and Control of a Prototype Manipulator SCARA Type as Teaching Tool,cp,Conference Paper,Neto M.B.D.S.,,Federal Institute of Pernambuco,Caruaru,Brazil,,,,,2015-01-01,2015,IFAC-PapersOnLine,,21100456158,24058963,Conference Proceeding,48,19,,209-213,,,5,1,publisherfree2read,Bronze,,,
203,2-s2.0-84964068311,10.1016/j.procs.2015.12.226,S187705091503687X,,Virtual Reality Application for Simulation and Off-line Programming of the Mitsubishi Movemaster RV-M1 Robot Integrated with the Oculus Rift to Improve Students Training,cp,Conference Paper,Crespo R.,,Tecnologico de Monterrey,Monterrey,Mexico,,,,,2015-01-01,2015,Procedia Computer Science,,19700182801,18770509,Conference Proceeding,75,,,107-112,,,22,1,repositoryvor,Green,,,
204,2-s2.0-84964053756,,,,Connecting natural language to task demonstrations and low-level control of industrial robots,cp,Conference Paper,Stenmark M.,,Lunds Universitet,Lund,Sweden,,,,,2015-01-01,2015,CEUR Workshop Proceedings,16130073,21100218356,,Conference Proceeding,1540,,,25-29,,,1,0,,,,,
205,2-s2.0-84964034123,,,,Learning object affordances for tool use and problem solving in cognitive robots,cp,Conference Paper,Jamone L.,,Instituto Superior Técnico,Lisbon,Portugal,,,,,2015-01-01,2015,CEUR Workshop Proceedings,16130073,21100218356,,Conference Proceeding,1544,,,68-82,,,0,0,,,,,
206,2-s2.0-84964026809,,,,Procedia Computer Science,cr,Conference Review,,,,,,,,,,2015-01-01,2015,Procedia Computer Science,,19700182801,18770509,Conference Proceeding,75,,,,,,0,0,,,,,
207,2-s2.0-84963998059,10.1016/j.procs.2015.12.253,S187705091503714X,,Open Data Motion Capture: MOCAP-ULL Database,cp,Conference Paper,Estévez-García R.,,Universidad de la Laguna,San Cristobal de La Laguna,Spain,,,,,2015-01-01,2015,Procedia Computer Science,,19700182801,18770509,Conference Proceeding,75,,,316-326,,,5,1,publisherfree2read,Bronze,,,
208,2-s2.0-84963705375,,,,Frontiers in Artificial Intelligence and Applications,cr,Conference Review,,,,,,,,,,2015-01-01,2015,Frontiers in Artificial Intelligence and Applications,09226389,19500157321,,Book Series,278,,,,,,0,0,,,,,
209,2-s2.0-84963606429,,,,Motion capturing for the simulation of manual industrial processes,cp,Conference Paper,Heinze F.,,RIF Institute for Research and Transfer eV,Dortmund,Germany,,,,,2015-01-01,2015,"13th International Industrial Simulation Conference 2015, ISC 2015",,21100455611,,Conference Proceeding,,,,48-52,,,2,0,,,,,
210,2-s2.0-84963543223,,,,Simulating and implementing the integration of service robots into manual work processes,cp,Conference Paper,Heinze F.,,RIF Institute for Research and Transfer eV,Dortmund,Germany,,,,,2015-01-01,2015,"29th Annual European Simulation and Modelling Conference 2015, ESM 2015",,21100455577,,Conference Proceeding,,,,371-376,,,0,0,,,,,
211,2-s2.0-84962787592,10.1016/j.procs.2015.12.271,S1877050915037722,,Robotic Training to Bridge School Students with Engineering,cp,Conference Paper,Balaji M.,,Frontline Electronics Pvt. Ltd,Salem,India,,,,,2015-01-01,2015,Procedia Computer Science,,19700182801,18770509,Conference Proceeding,76,,,27-33,,,7,1,publisherfree2read,Bronze,,,
212,2-s2.0-84962758385,10.1016/j.procs.2015.12.194,S1877050915036558,,Respective Advantages and Disadvantages of Model-based and Model-free Reinforcement Learning in a Robotics Neuro-inspired Cognitive Architecture,cp,Conference Paper,Renaudo E.,,Institut des Systèmes Intelligents et de Robotique;Sorbonne Université,Paris;Paris,France;France,,,,,2015-01-01,2015,Procedia Computer Science,,19700182801,18770509,Conference Proceeding,71,,,178-184,,,9,1,repositoryvor,Green,,,
213,2-s2.0-84962659920,10.1016/j.procs.2015.12.061,S187705091503522X,,Synchronized Communication in a Set of Autonomous Mobile Robots Using Bluetooth Technology,cp,Conference Paper,Houda K.,,Université Kasdi Merbah Ouargla;Université Badji Mokhtar - Annaba,Ouargla;Annaba,Algeria;Algeria,,,,,2015-01-01,2015,Procedia Computer Science,,19700182801,18770509,Conference Proceeding,73,,,154-161,,,5,1,publisherfree2read,Bronze,,,
214,2-s2.0-84962640462,,,,Paper robot: A design activity to increase beginner's prototyping confidence with microcontrollers,cp,Conference Paper,Analytis S.,,Stanford University,Palo Alto,United States,,,,,2015-01-01,2015,ICDC 2015 - Proceedings of the 3rd International Conference on Design Creativity,,21100455464,,Conference Proceeding,,,,200-208,,,3,0,,,,,
215,2-s2.0-84960290251,10.1515/9781614514404.173,,,Extensible grounding of speech for robot instruction,ch,Book Chapter,Connell J.,,IBM Thomas J. Watson Research Center,Yorktown Heights,United States,,,,,2015-01-01,1 January 2015,Robots that Talk and Listen: Technology and Social Impact,,21100449470,,Book,,,,175-202,,,3,0,,,,,
216,2-s2.0-84959890309,,,,Comparative study on programmable robots as programming educational tools,cp,Conference Paper,Yamazaki S.,,Waseda University,Tokyo,Japan,,,,,2015-01-01,January 2015,Conferences in Research and Practice in Information Technology Series,14451336,21100203102,,Conference Proceeding,160,,,155-164,,,4,0,,,,,
217,2-s2.0-84958766701,,,,Devices in the internet of things,ar,Article,Boyle D.,,Imperial College London,London,United Kingdom,,,,,2015-01-01,2015,Journal of the Institute of Telecommunications Professionals,17559278,11700154352,,Journal,9,4,,26-31,,,2,0,,,,,
218,2-s2.0-84958531344,10.1007/978-3-319-18615-3_7,,,CIT brains KidSize robot: RoboCup 2014 best humanoid award winner,cp,Conference Paper,Hayashibara Y.,,Chiba Institute of Technology,Narashino,Japan,,,,,2015-01-01,2015,Lecture Notes in Artificial Intelligence (Subseries of Lecture Notes in Computer Science),03029743,25674,,Conference Proceeding,8992,,,82-93,,,1,0,,,,,
219,2-s2.0-84956878218,10.1155/2015/597956,,,Genetic Scheduling and Reinforcement Learning in Multirobot Systems for Intelligent Warehouses,ar,Article,Dou J.,,Nanjing University,Nanjing,China,,,,,2015-01-01,2015,Mathematical Problems in Engineering,1024123X,13082,15635147,Journal,2015,,597956,,,,36,1,repositoryam,Green,,,
220,2-s2.0-84956639853,,,,"13th International Conference on Software Engineering and Formal Methods, SEFM 2015 Collocated with ATSE, HOFM, MoKMaSD, and VERY SCART",cr,Conference Review,,,,,,,,,,2015-01-01,2015,Lecture Notes in Computer Science (including subseries Lecture Notes in Artificial Intelligence and Lecture Notes in Bioinformatics),03029743,25674,16113349,Book Series,9509,,,1-324,,,0,0,,,,,
221,2-s2.0-84955319785,10.1007/978-3-319-26832-3_32,,,An optimal path planning for multiple mobile robots using AIS and GA: A hybrid approach,cp,Conference Paper,Panda M.,,C. V. Raman College of Engineering,Bhubaneswar,India,,,,,2015-01-01,2015,Lecture Notes in Computer Science (including subseries Lecture Notes in Artificial Intelligence and Lecture Notes in Bioinformatics),03029743,25674,16113349,Book Series,9468,,,334-346,,,0,0,,,,,
222,2-s2.0-84954489441,,,,A maker approach to computer science education: Lessons learned from a first-year university course,cp,Conference Paper,Svanæs D.,,Norges Teknisk-Naturvitenskapelige Universitet,Trondheim,Norway,,,,,2015-01-01,2015,CEUR Workshop Proceedings,16130073,21100218356,,Conference Proceeding,1450,,,15-20,,,2,0,,,,,
223,2-s2.0-84954129314,10.1007/978-3-319-23708-4_3,,,Nonmonotonic learning in large biological networks,cp,Conference Paper,Bragaglia S.,,University of Bristol,Bristol,United Kingdom,,,,,2015-01-01,2015,Lecture Notes in Computer Science (including subseries Lecture Notes in Artificial Intelligence and Lecture Notes in Bioinformatics),03029743,25674,16113349,Book Series,9046,,,33-48,,,4,0,repositoryam,Green,,,
224,2-s2.0-84952665397,,,,"20th International Conference on Logic for Programming, Artificial Intelligence, and Reasoning, LPAR 2015",cr,Conference Review,,,,,,,,,,2015-01-01,2015,Lecture Notes in Computer Science (including subseries Lecture Notes in Artificial Intelligence and Lecture Notes in Bioinformatics),03029743,25674,16113349,Book Series,9450,,,1-638,,,0,0,,,,,
225,2-s2.0-84952342573,,,,Probabilistic Programming and Its Applications (Keynote Abstract),cp,Conference Paper,De Raedt L.,,KU Leuven,3000 Leuven,Belgium,,,,,2015-01-01,2015,Lecture Notes in Computer Science (including subseries Lecture Notes in Artificial Intelligence and Lecture Notes in Bioinformatics),03029743,25674,16113349,Book Series,9426,,,XIII-XIV,,,1,0,,,,,
226,2-s2.0-84951821574,,,,"8th International Conference on Intelligent Robotics and Applications, ICIRA 2015",cr,Conference Review,,,,,,,,,,2015-01-01,2015,Lecture Notes in Computer Science (including subseries Lecture Notes in Artificial Intelligence and Lecture Notes in Bioinformatics),03029743,25674,16113349,Book Series,9245,,,1-710,,,0,0,,,,,
227,2-s2.0-84950160149,10.1007/978-3-319-25768-6_18,,,Mathematical machines and integrated stem: An intersubjective constructionist approach,cp,Conference Paper,Sengupta P.,,Vanderbilt University's Peabody College,Nashville,United States,,,,,2015-01-01,2015,Communications in Computer and Information Science,18650929,17700155007,,Book Series,510,,,272-288,,,3,0,,,,,
228,2-s2.0-84949949988,10.17485/ijst/2015/v8i26/80723,,,Learning effects of pedagogical robots with programming in elementary school environments in Korea,ar,Article,Park I.,,Korea University,Seoul,South Korea,,,,,2015-01-01,2015,Indian Journal of Science and Technology,09746846,21100201522,09745645,Journal,8,26,IPL0479,,,,13,1,publisherfree2read,Bronze,,,
229,2-s2.0-84949008319,10.1007/978-3-319-19773-9_99,,,Domain model for adaptive blended courses on basic programming,cp,Conference Paper,Larrañaga M.,,Universidad del Pais Vasco,Leioa,Spain,,,,,2015-01-01,2015,Lecture Notes in Computer Science (including subseries Lecture Notes in Artificial Intelligence and Lecture Notes in Bioinformatics),03029743,25674,16113349,Book Series,9112,,,714-717,,,1,0,,,,,
230,2-s2.0-84948759871,10.1007/978-3-319-19656-5_8,,,A cognitive approach to affordance learning in robotic ecologies,cp,Conference Paper,Dragone M.,,Trinity College Dublin,Dublin,Ireland,,,,,2015-01-01,2015,"Lecture Notes of the Institute for Computer Sciences, Social-Informatics and Telecommunications Engineering, LNICST",18678211,21100220348,,Book Series,150,,,54-57,,,0,0,,,,,
231,2-s2.0-84947917723,10.1007/978-3-319-19875-0_12,,,“Living books” and the advanced network technologies for education in a technical university,cp,Conference Paper,Antokhina Y.,,Saint-Petersburg State University of Aerospace Instrumentation,Saint Petersburg,Russian Federation,,,,,2015-01-01,2015,"Smart Innovation, Systems and Technologies",21903018,21100204111,21903026,Book Series,41,,,129-139,,,2,0,,,,,
232,2-s2.0-84947575995,,,,Accurately detecting source code of attacks that increase privilege,ar,Article,Cunningham R.K.,,Lincoln Laboratory,Lexington,United States,,,,,2015-01-01,2015,Lecture Notes in Computer Science (including subseries Lecture Notes in Artificial Intelligence and Lecture Notes in Bioinformatics),03029743,25674,16113349,Book Series,2212,,,104-116,,,2,0,,,,,
233,2-s2.0-84947213448,10.1007/978-3-319-20684-4_16,,,A JBrick: Accessible robotics programming for visually impaired users,cp,Conference Paper,Ludi S.,,Rochester Institute of Technology,Rochester,United States,,,,,2015-01-01,2015,Lecture Notes in Computer Science (including subseries Lecture Notes in Artificial Intelligence and Lecture Notes in Bioinformatics),03029743,25674,16113349,Book Series,9177,,,157-168,,,0,0,,,,,
234,2-s2.0-84947092954,10.1007/978-3-319-20609-7_11,,,A Tablet-Based lego mindstorms programming environment for children,cp,Conference Paper,Ludi S.,,Rochester Institute of Technology,Rochester,United States,,,,,2015-01-01,2015,Lecture Notes in Computer Science (including subseries Lecture Notes in Artificial Intelligence and Lecture Notes in Bioinformatics),03029743,25674,16113349,Book Series,9192,,,106-114,,,0,1,publisherfree2read,Bronze,,,
235,2-s2.0-84947092903,10.1007/978-3-319-20609-7_51,,,A platform for supporting the development of mixed reality environments for educational games,cp,Conference Paper,Arenas L.,,Universidad Carlos III de Madrid,Madrid,Spain,,,,,2015-01-01,2015,Lecture Notes in Computer Science (including subseries Lecture Notes in Artificial Intelligence and Lecture Notes in Bioinformatics),03029743,25674,16113349,Book Series,9192,,,537-548,,,4,0,,,,,
236,2-s2.0-84947086867,10.1007/978-3-319-20609-7_13,,,Supporting the development of computational thinking: A robotic platform controlled by smartphone,cp,Conference Paper,Sarmento H.,,Universidade Tecnológica Federal do Paraná,Curitiba,Brazil,,,,,2015-01-01,2015,Lecture Notes in Computer Science (including subseries Lecture Notes in Artificial Intelligence and Lecture Notes in Bioinformatics),03029743,25674,16113349,Book Series,9192,,,124-135,,,2,0,,,,,
237,2-s2.0-84947072993,,,,"2nd International Conference on Learning and Collaboration Technologies, LCT 2015",cr,Conference Review,,,,,,,,,,2015-01-01,2015,Lecture Notes in Computer Science (including subseries Lecture Notes in Artificial Intelligence and Lecture Notes in Bioinformatics),03029743,25674,16113349,Book Series,9192,,,1-736,,,0,0,,,,,
238,2-s2.0-84946763013,10.1007/978-3-319-19824-8_25,,,Labyrinth arrangement analysis based on image processing,cp,Conference Paper,Škrabánek P.,,Univerzita Pardubice,Pardubice,Czech Republic,,,,,2015-01-01,2015,Advances in Intelligent Systems and Computing,21945357,5100152904,,Book Series,378,,,305-316,,,5,0,,,,,
239,2-s2.0-84945426263,10.1016/j.neunet.2015.07.004,S0893608015001410,26422422,Neuromorphic implementations of neurobiological learning algorithms for spiking neural networks,ar,Article,Walter F.,,"Fakultät für Informatik, Technische Universität München",Garching bei Munchen,Germany,,,,,2015-01-01,2015,Neural Networks,08936080,24804,18792782,Journal,72,,,152-167,,,43,0,repositoryvor,Green,,,
240,2-s2.0-84945175320,,,,Teaching robots parametrized executable plans through spoken interaction,cp,Conference Paper,Gemignani G.,,Sapienza Università di Roma,Rome,Italy,,,,,2015-01-01,2015,"Proceedings of the International Joint Conference on Autonomous Agents and Multiagent Systems, AAMAS",15488403,21100310020,15582914,Conference Proceeding,2,,,851-859,,,19,0,,,,,
241,2-s2.0-84944712211,,,,Leading the way: An efficient multi-robot guidance system,cp,Conference Paper,Khandelwal P.,,The University of Texas at Austin,Austin,United States,,,,,2015-01-01,2015,"Proceedings of the International Joint Conference on Autonomous Agents and Multiagent Systems, AAMAS",15488403,21100310020,15582914,Conference Proceeding,3,,,1625-1633,,,11,0,,,,,
242,2-s2.0-84944680755,,,,On task recognition and generalization in long-term robot teaching,cp,Conference Paper,Gemignani G.,,Sapienza Università di Roma,Rome,Italy,,,,,2015-01-01,2015,"Proceedings of the International Joint Conference on Autonomous Agents and Multiagent Systems, AAMAS",15488403,21100310020,15582914,Conference Proceeding,3,,,1879-1880,,,4,0,,,,,
243,2-s2.0-84944673528,10.1007/s00779-014-0774-3,,,Evaluating children performance with graphical and tangible robot programming tools,ar,Article,Sapounidis T.,,Aristotle University of Thessaloniki,Thessaloniki,Greece,,,,,2015-01-01,1 January 2015,Personal and Ubiquitous Computing,16174909,22315,,Journal,19,1,,225-237,,,54,0,,,,,
244,2-s2.0-84944533466,10.1007/978-3-662-43505-2_76,,,Evolving embedded fuzzy controllers,ch,Book Chapter,Montiel O.,,,,,,,,,2015-01-01,1 January 2015,Springer Handbook of Computational Intelligence,,21100417203,,Book,,,,1451-1477,,,1,0,,,,,
245,2-s2.0-84944345978,,,,Design strategies for developing a visual platform for physical computing with mobile tools for project documentation and reflection,cp,Conference Paper,Spikol D.,,Malmö Högskola,Malmo,Sweden,,,,,2015-01-01,2015,CEUR Workshop Proceedings,16130073,21100218356,,Conference Proceeding,1432,,,57-62,,,1,0,,,,,
246,2-s2.0-84944096696,10.1007/978-3-319-16913-2,,,"Smart learning objects for smart education in computer science: Theory, methodology and robot-based implementation",bk,Book,Štuikys V.,,Kaunas University of Technology,Kaunas,Lithuania,,,,,2015-01-01,1 January 2015,"Smart Learning Objects for Smart Education in Computer Science: Theory, Methodology and Robot-Based Implementation",,21100416143,,Book,,,,1-315,,,18,0,,,,,
247,2-s2.0-84943766451,10.1007/978-3-319-11704-1,,,ARM assembly language with hardware experiments,bk,Book,Elahi A.,,Southern Connecticut State University,New Haven,United States,,,,,2015-01-01,1 January 2015,ARM Assembly Language with Hardware Experiments,,21100415791,,Book,,,,1-139,,,1,0,repositoryam,Green,,,
248,2-s2.0-84943637169,10.1007/978-3-319-22383-4_7,,,Practical applications and experiments with the syrotek platform,cp,Conference Paper,Kulich M.,,Czech Technical University in Prague,Prague,Czech Republic,,,,,2015-01-01,2015,Lecture Notes in Computer Science (including subseries Lecture Notes in Artificial Intelligence and Lecture Notes in Bioinformatics),03029743,25674,16113349,Book Series,9055,,,90-101,,,0,0,,,,,
249,2-s2.0-84943544178,10.5220/0005547000250031,,,Application of sensory body schemas to path planning for micro air vehicles (MAVs),cp,Conference Paper,Enikov E.T.,,The University of Arizona,Tucson,United States,,,,,2015-01-01,2015,"ICINCO 2015 - 12th International Conference on Informatics in Control, Automation and Robotics, Proceedings",,21100415011,,Conference Proceeding,1,,,25-31,,,2,1,publisherhybridgold,Hybrid Gold,,,
250,2-s2.0-84943525294,10.5875/ausmt.v5i3.979,,,A collaborative authoring workspace and script-based control platform for heterogeneous robots,ar,Article,Lin J.,,Shih Hsin University,Taipei,Taiwan,,,,,2015-01-01,2015,International Journal of Automation and Smart Technology,,21100327713,22239766,Journal,5,3,,163-171,,,0,1,publisherfullgold,Gold,,,
251,2-s2.0-84943514888,,,,Option-based motion planning and ANFIS-based tracking control for wheeled robot in cluttered environment,cp,Conference Paper,Feng Y.,,Northwestern Polytechnical University,Xi'an,China,,,,,2015-01-01,2015,"ICINCO 2015 - 12th International Conference on Informatics in Control, Automation and Robotics, Proceedings",,21100415011,,Conference Proceeding,1,,,287-293,,,4,0,,,,,
252,2-s2.0-84943273387,10.5220/0005193803410348,,,The localization of mindstorms NXT in the magnetic unstable environment based on histogram filtering,cp,Conference Paper,Artiemjew P.,,Uniwersytet Warminsko-Mazurski w Olsztynie, Olsztyn WM,Poland,,,,,2015-01-01,2015,"ICAART 2015 - 7th International Conference on Agents and Artificial Intelligence, Proceedings",,21100414306,,Conference Proceeding,2,,,341-348,,,1,0,,,,,
253,2-s2.0-84943146005,,,,Lego<sup>©</sup> mindstorms: Merely a toy or a powerful pedagogical tool for learning computer programming?,cp,Conference Paper,Chetty J.,,University of Johannesburg,Johannesburg,South Africa,,,,,2015-01-01,2015,Conferences in Research and Practice in Information Technology Series,14451336,21100203102,,Conference Proceeding,159,,,111-118,,,8,0,,,,,
254,2-s2.0-84943138409,,,,"Proceedings of the 38th Australasian Computer Science Conference, ACSC 2015",cr,Conference Review,,,,,,,,,,2015-01-01,2015,Conferences in Research and Practice in Information Technology Series,14451336,21100203102,,Conference Proceeding,159,,,,,,0,0,,,,,
255,2-s2.0-84942891052,10.1016/B978-0-12-802118-7.00007-8,B9780128021187000078,,Deep-Learning Numerical Optimization,ch,Book Chapter,Farber R.,,,,,,,,,2015-01-01,2015,High Performance Parallelism Pearls: Multicore and Many-core Programming Approaches,,21100962596,,Book,,,,129-142,,,1,0,,,,,
256,2-s2.0-84942606966,,,,"3rd International Conference on Robot Intelligence Technology and Applications, RiTA 2014",cr,Conference Review,,,,,,,,,,2015-01-01,2015,Advances in Intelligent Systems and Computing,21945357,5100152904,,Book Series,345,,,1-834,,,0,0,,,,,
257,2-s2.0-84942588981,10.1007/978-3-319-16841-8_5,,,Path mapping and planning with partially known paths using hierarchical state machine for service robot,cp,Conference Paper,Nippun Kumaar A.,,"Amrita Vishwa Vidyapeetham University, Bangalore",Bengaluru,India,,,,,2015-01-01,2015,Advances in Intelligent Systems and Computing,21945357,5100152904,,Book Series,345,,,45-55,,,0,0,,,,,
258,2-s2.0-84942579360,,,,"13th International Conference on Intelligent Software Methodologies, Tools and Techniques, SoMeT 2014",cr,Conference Review,,,,,,,,,,2015-01-01,2015,Communications in Computer and Information Science,18650929,17700155007,,Book Series,513,,,1-405,,,0,0,,,,,
259,2-s2.0-84942242181,10.3991/ijoe.v11i5.4752,,,Experiments with a virtual lab for industrial robots programming,ar,Article,Abreu P.,,Universidade do Porto,Porto,Portugal,,,,,2015-01-01,2015,International Journal of Online Engineering,18681646,20000195073,18612121,Journal,11,5,,10-16,,,4,1,publisherfullgold,Gold,,,
260,2-s2.0-84941996725,,,,Student learning of STEM concepts using a challenge-based robotics curriculum,cp,Conference Paper,McKay M.M.,,Stevens Institute of Technology,Hoboken,United States,,,,,2015-01-01,2015,"ASEE Annual Conference and Exposition, Conference Proceedings",,21100797240,21535965,Conference Proceeding,122nd ASEE Annual Conference and Exposition: Making Value for Society,122nd ASEE Annual Conference and Exposition: Making Value for Society,,,,,4,0,,,,,
261,2-s2.0-84941996244,,,,"Preparing students for the advanced manufacturing environment through robotics, mechatronics and automation training",cp,Conference Paper,Djuric A.,,Wayne State University,Detroit,United States,,,,,2015-01-01,2015,"ASEE Annual Conference and Exposition, Conference Proceedings",,21100797240,21535965,Conference Proceeding,122nd ASEE Annual Conference and Exposition: Making Value for Society,122nd ASEE Annual Conference and Exposition: Making Value for Society,,,,,1,0,,,,,
262,2-s2.0-84941995989,,,,A novel architecture for electromechanical trainers allowing selectable control by either microcontroller or PLC,cp,Conference Paper,Browne A.,,The University of North Carolina at Charlotte,Charlotte,United States,,,,,2015-01-01,2015,"ASEE Annual Conference and Exposition, Conference Proceedings",,21100797240,21535965,Conference Proceeding,122nd ASEE Annual Conference and Exposition: Making Value for Society,122nd ASEE Annual Conference and Exposition: Making Value for Society,,,,,0,0,,,,,
263,2-s2.0-84941995847,,,,Microcontrollers for non-electrical engineering students - Do we need to teach assembly language?,cp,Conference Paper,He S.,,Vaughn College,Flushing,United States,,,,,2015-01-01,2015,"ASEE Annual Conference and Exposition, Conference Proceedings",,21100797240,21535965,Conference Proceeding,122nd ASEE Annual Conference and Exposition: Making Value for Society,122nd ASEE Annual Conference and Exposition: Making Value for Society,,,,,1,0,,,,,
264,2-s2.0-84941995004,,,,Innovation to entrepreneurship in the first year engineering experience,cp,Conference Paper,Riofrio J.A.,,Western New England University,Springfield,United States,,,,,2015-01-01,2015,"ASEE Annual Conference and Exposition, Conference Proceedings",,21100797240,21535965,Conference Proceeding,122nd ASEE Annual Conference and Exposition: Making Value for Society,122nd ASEE Annual Conference and Exposition: Making Value for Society,,,,,13,0,,,,,
265,2-s2.0-84941993789,,,,An educational tool to support introductory robotics courses,cp,Conference Paper,Gonzalez F.G.,,Florida Gulf Coast University,Fort Myers,United States,,,,,2015-01-01,2015,"ASEE Annual Conference and Exposition, Conference Proceedings",,21100797240,21535965,Conference Proceeding,122nd ASEE Annual Conference and Exposition: Making Value for Society,122nd ASEE Annual Conference and Exposition: Making Value for Society,,,,,2,0,,,,,
266,2-s2.0-84941993758,,,,Academia and industry partnership: Building state-of-the-art industrial control and automation laboratory,cp,Conference Paper,Sergeyev A.,,Michigan Technological University,Houghton,United States,,,,,2015-01-01,2015,"ASEE Annual Conference and Exposition, Conference Proceedings",,21100797240,21535965,Conference Proceeding,122nd ASEE Annual Conference and Exposition: Making Value for Society,122nd ASEE Annual Conference and Exposition: Making Value for Society,,,,,2,0,,,,,
