,eid,doi,pii,pubmed_id,title,subtype,subtypeDescription,creator,afid,affilname,affiliation_city,affiliation_country,author_count,author_names,author_ids,author_afids,coverDate,coverDisplayDate,publicationName,issn,source_id,eIssn,aggregationType,volume,issueIdentifier,article_number,pageRange,description,authkeywords,citedby_count,openaccess,freetoread,freetoreadLabel,fund_acr,fund_no,fund_sponsor
198,2-s2.0-85054152790,,,,"Proceedings of the 21st International Workshop on Software and Compilers for Embedded Systems, SCOPES 2018",cr,Conference Review,,,,,,,,,,2018-05-28,28 May 2018,"Proceedings of the 21st International Workshop on Software and Compilers for Embedded Systems, SCOPES 2018",,21100878871,,Conference Proceeding,,,,,,,0,0,,,,,
199,2-s2.0-85054142421,10.1145/3207719.3207722,,,Reinforcement learning for power-efficient grant prediction in LTE,cp,Conference Paper,Brand P.,,Friedrich-Alexander-Universität Erlangen-Nürnberg,Erlangen,Germany,,,,,2018-05-28,28 May 2018,"Proceedings of the 21st International Workshop on Software and Compilers for Embedded Systems, SCOPES 2018",,21100878871,,Conference Proceeding,,,,18-26,,,3,0,,,,,
200,2-s2.0-85049681086,10.1145/3183440.3183463,,,Multi-platform computing for physical devices via MakeCode and CODAL,cp,Conference Paper,Ball T.,,Microsoft Research,Redmond,United States,,,,,2018-05-27,27 May 2018,Proceedings - International Conference on Software Engineering,02705257,19242,,Conference Proceeding,,,,552-554,,,2,0,,,,,
201,2-s2.0-85048121253,10.1109/EDUCON.2018.8363498,,,"Coding, playgrounds and literacy in early childhood education: The development of KIBO robotics and ScratchJr",cp,Conference Paper,Bers M.,,Tufts University,Medford,United States,,,,,2018-05-23,23 May 2018,"IEEE Global Engineering Education Conference, EDUCON",21659559,21100206205,21659567,Conference Proceeding,2018-April,,,2094-2102,,,39,0,,,,,
202,2-s2.0-85048111087,10.1109/EDUCON.2018.8363402,,,Karel releams C: Teaching good software engineering practices in CS1 with Karel the Robot,cp,Conference Paper,Heckner M.,,Ostbayerische Technische Hochschule Regensburg,Regensburg,Germany,,,,,2018-05-23,23 May 2018,"IEEE Global Engineering Education Conference, EDUCON",21659559,21100206205,21659567,Conference Proceeding,2018-April,,,1447-1454,,,0,0,,,,,
203,2-s2.0-85048104298,10.1109/EDUCON.2018.8363269,,,Conception of a Lego Mindstorms EV3 simulation for teaching C in computer science courses,cp,Conference Paper,Haak V.,,Fachhochschule Aschaffenburg,Aschaffenburg,Germany,,,,,2018-05-23,23 May 2018,"IEEE Global Engineering Education Conference, EDUCON",21659559,21100206205,21659567,Conference Proceeding,2018-April,,,478-483,,,10,0,,,,,
204,2-s2.0-85048081564,10.1109/EDUCON.2018.8363393,,,An approach to design of the cyber-physical systems for engineering-education,cp,Conference Paper,Veljovic A.,,University of Kragujevac,Kragujevac,Serbia,,,,,2018-05-23,23 May 2018,"IEEE Global Engineering Education Conference, EDUCON",21659559,21100206205,21659567,Conference Proceeding,2018-April,,,1402-1407,,,2,0,,,,,
205,2-s2.0-85048078320,10.1109/EDUCON.2018.8363239,,,Balancing low-level vs. high-level programming knowledge in an undergraduate microprocessors course,cp,Conference Paper,El-Abd M.,,American University of Kuwait,Kuwait City,Kuwait,,,,,2018-05-23,23 May 2018,"IEEE Global Engineering Education Conference, EDUCON",21659559,21100206205,21659567,Conference Proceeding,2018-April,,,268-275,,,1,0,,,,,
206,2-s2.0-85048077852,10.1109/EDUCON.2018.8363483,,,Traffic lights through multiple robotic educational tools,cp,Conference Paper,Plaza P.,,,,,,,,,2018-05-23,23 May 2018,"IEEE Global Engineering Education Conference, EDUCON",21659559,21100206205,21659567,Conference Proceeding,2018-April,,,2015-2020,,,26,0,,,,,
207,2-s2.0-85048075130,10.1109/EDUCON.2018.8363454,,,Perceptions of computer science among children after a hands-on activity: A pilot study,cp,Conference Paper,Henry J.,,Namur Digital Institute,Namur,Belgium,,,,,2018-05-23,23 May 2018,"IEEE Global Engineering Education Conference, EDUCON",21659559,21100206205,21659567,Conference Proceeding,2018-April,,,1811-1817,,,4,0,,,,,
208,2-s2.0-85048069726,10.1109/EDUCON.2018.8363487,,,Robotics tips and tricks for inclusion and integration of students,cp,Conference Paper,Peixoto A.,,Centro Federal De Educacão Tecnológica Celso Suckow Da Fonseca,Rio de Janeiro,Brazil,,,,,2018-05-23,23 May 2018,"IEEE Global Engineering Education Conference, EDUCON",21659559,21100206205,21659567,Conference Proceeding,2018-April,,,2037-2041,,,25,0,,,,,
209,2-s2.0-85048065068,10.1109/EDUCON.2018.8363230,,,Scratch day to introduce robotics,cp,Conference Paper,Plaza P.,,,,,,,,,2018-05-23,23 May 2018,"IEEE Global Engineering Education Conference, EDUCON",21659559,21100206205,21659567,Conference Proceeding,2018-April,,,208-216,,,20,0,,,,,
210,2-s2.0-85048835074,10.1145/3204919.3204926,,,TensorFlow acceleration on ARM hikey board,cp,Conference Paper,Goli M.,,Codeplay Software Ltd.,Edinburgh,United Kingdom,,,,,2018-05-14,14 May 2018,ACM International Conference Proceeding Series,,11600154611,,Conference Proceeding,,,3204926,,,,1,0,,,,,
211,2-s2.0-85048987547,10.1049/cje.2018.03.001,,,ALLIANCE-ROS: A software framework on ros for fault-tolerant and cooperative mobile robots,ar,Article,Guo Z.,,National University of Defense Technology China,Changsha,China,,,,,2018-05-10,10 May 2018,Chinese Journal of Electronics,10224653,24184,20755597,Journal,27,3,,467-475,,,15,0,,,,,
212,2-s2.0-85053901438,10.1145/3209635.3209643,,,Engaging secondary and post-secondary students to learn and explore programming using a theme-based curriculum and the sphero SPRK+ robot,cp,Conference Paper,Hadfield S.M.,,United States Air Force Academy,Colorado Springs,United States,,,,,2018-05-04,4 May 2018,"Proceedings of the 23rd Western Canadian Conference on Computing Education, WCCCE 2018 - Held in cooperation with the ACM Special Interest Group on Computer Science Education (SIGCSE)",,21100878040,,Conference Proceeding,,,,,,,1,0,,,,,
213,2-s2.0-85082533932,10.1016/j.aci.2018.04.005,,,Intensive summer course in robotics – Robotcraft,ar,Article,Ferreira N.M.F.,,"Grupo de Investigação em Engenharia e Computação Inteligente para a Inovação e o Desenvolvimento;Coimbra Polytechnic - ISEC;Institute for Systems and Computer Engineering, Technology and Science",Porto;Coimbra;Porto,Portugal;Portugal;Portugal,,,,,2018-05-01,1 May 2018,Applied Computing and Informatics,26341964,21100862637,22108327,Journal,16,1-2,,155-179,,,12,1,publisherfullgold,Gold,,,
214,2-s2.0-85053922301,10.3969/j.issn.0372-2112.2018.05.035,,,RGB-D Scene Parsing Based on Spatial Structured Inference Deep Fusion Networks,ar,Article,Wang Z.,,Harbin Engineering University,Harbin,China,,,,,2018-05-01,1 May 2018,Tien Tzu Hsueh Pao/Acta Electronica Sinica,03722112,24288,,Journal,46,5,,1253-1258,,,5,0,,,,,
215,2-s2.0-85047391698,10.1177/0278364918771476,,,Towards real-time 3D continuous occupancy mapping using Hilbert maps,ar,Article,Guizilini V.,,The University of Sydney,Sydney,Australia,,,,,2018-05-01,1 May 2018,International Journal of Robotics Research,02783649,18050,17413176,Journal,37,6,,566-584,,,9,0,,,,,
216,2-s2.0-85035123497,10.1007/s11432-016-9115-2,,,Path planning for mobile robot using self-adaptive learning particle swarm optimization,ar,Article,Li G.,,Beihang University,Beijing,China,,,,,2018-05-01,1 May 2018,Science China Information Sciences,1674733X,19600161832,18691919,Journal,61,5,052204,,,,118,0,,,,,
217,2-s2.0-85078746134,,,,A comparison of changes in science interest and identity and 21st century learning skills in a mixed-gender and single-gender robotics program for elementary/ middle school youth,cp,Conference Paper,Sontgerath S.,,Worcester Polytechnic Institute,Worcester,United States,,,,,2018-04-29,29 April 2018,CoNECD 2018 - Collaborative Network for Engineering and Computing Diversity Conference,,21101028546,,Conference Proceeding,,,,,,,5,0,,,,,
218,2-s2.0-85046378997,10.1109/ACCESS.2018.2830661,,,"A Survey of Deep Learning: Platforms, Applications and Emerging Research Trends",ar,Article,Hatcher W.G.,,Towson University,Towson,United States,,,,,2018-04-26,26 April 2018,IEEE Access,,21100374601,21693536,Journal,6,,,24411-24432,,,323,1,publisherfullgold,Gold,,,
219,2-s2.0-85056725153,10.1515/itit-2017-0032,,,Empowering learners with tools in CS education: Physical computing in secondary schools,ar,Article,Przybylla M.,,Universität Potsdam,Potsdam,Germany,,,,,2018-04-25,25 April 2018,IT - Information Technology,16112776,21100929583,21967032,Journal,60,2,,,,,4,0,,,,,
220,2-s2.0-85050987640,10.1109/ICOMET.2018.8346452,,,PSO based localization of multiple mobile robots emplying LEGO EV3,cp,Conference Paper,Bibi R.,,Mehran University of Engineering &amp; Technology,Jamshoro,Pakistan,,,,,2018-04-24,24 April 2018,"2018 International Conference on Computing, Mathematics and Engineering Technologies: Invent, Innovate and Integrate for Socioeconomic Development, iCoMET 2018 - Proceedings",,21100871260,,Conference Proceeding,2018-January,,,1-5,,,3,0,,,,,
221,2-s2.0-85072743089,10.1007/978-3-319-75844-2,,,World of computing: A primer companion for the digital age,bk,Book,O'Regan G.,,"Mallow, Co.",Cork,Ireland,,,,,2018-04-17,17 April 2018,World of Computing: A Primer Companion for the Digital Age,,21100930128,,Book,,,,1-320,,,1,0,repositoryam,Green,,,
222,2-s2.0-85048087215,10.1109/ISECon.2018.8340468,,,Development of an embedded system course to teach the Internet-of-Things,cp,Conference Paper,Rao A.R.,,Fairleigh Dickinson University,Teaneck,United States,,,,,2018-04-17,17 April 2018,ISEC 2018 - Proceedings of the 8th IEEE Integrated STEM Education Conference,,21100863066,,Conference Proceeding,2018-January,,,154-160,,,15,0,,,,,
223,2-s2.0-85046287629,10.1088/1757-899X/336/1/012047,,,Design of Smart Educational Robot as a Tool for Teaching Media Based on Contextual Teaching and Learning to Improve the Skill of Electrical Engineering Student,cp,Conference Paper,Zuhrie M.,,Universitas Negeri Surabaya,Surabaya,Indonesia,,,,,2018-04-16,16 April 2018,IOP Conference Series: Materials Science and Engineering,17578981,19700200831,1757899X,Conference Proceeding,336,1,012047,,,,3,1,publisherfree2read,Bronze,,,
224,2-s2.0-85051218173,,,,"Proceedings of the 29th International Conference on Cybernetics and Informatics, K and I 2018",cr,Conference Review,,,,,,,,,,2018-04-12,12 April 2018,"Proceedings of the 29th International Conference on Cybernetics and Informatics, K and I 2018",,21100872084,,Conference Proceeding,2018-January,,,,,,0,0,,,,,
225,2-s2.0-85045108015,10.3390/su10041102,,,A low-cost immersive virtual reality system for teaching robotic manipulators programming,ar,Article,Román-Ibáñez V.,,Universitat d'Alacant,Alicante,Spain,,,,,2018-04-07,7 April 2018,Sustainability (Switzerland),,21100240100,20711050,Journal,10,4,1102,,,,40,1,repositoryam,Green,,,
226,2-s2.0-85049608147,10.1109/IRC.2018.00058,,,Implementation of feeding task via learning from demonstration,cp,Conference Paper,Ettehadi N.,,University of Central Florida,Orlando,United States,,,,,2018-04-02,2 April 2018,"Proceedings - 2nd IEEE International Conference on Robotic Computing, IRC 2018",,21100867392,,Conference Proceeding,2018-January,,,274-277,,,3,0,,,,,
227,2-s2.0-85048344347,10.4271/05-11-01-0001,,,Classification of Contact Forces in Human-Robot Collaborative Manufacturing Environments,ar,Article,Zhao R.,,University of Nottingham,Nottingham,United Kingdom,,,,,2018-04-02,2 April 2018,SAE International Journal of Materials and Manufacturing,19463979,19700174666,19463987,Journal,11,1,,5-10,,,1,0,,,,,
228,2-s2.0-85044466039,10.1109/DEVLRN.2017.8329826,,,Learning at the ends: From hand to tool affordances in humanoid robots,cp,Conference Paper,Saponaro G.,,Instituto Superior Técnico,Lisbon,Portugal,,,,,2018-04-02,2 April 2018,"7th Joint IEEE International Conference on Development and Learning and on Epigenetic Robotics, ICDL-EpiRob 2017",,21100869442,,Conference Proceeding,2018-January,,,321-337,,,9,0,repositoryam,Green,,,
229,2-s2.0-85039899545,10.1109/DEVLRN.2017.8329818,,,Grounded representations through deep variational inference and dynamic programming,cp,Conference Paper,Olier J.S.,,Technische Universiteit Eindhoven;Università degli Studi di Genova,Eindhoven;Genoa,Netherlands;Italy,,,,,2018-04-02,2 April 2018,"7th Joint IEEE International Conference on Development and Learning and on Epigenetic Robotics, ICDL-EpiRob 2017",,21100869442,,Conference Proceeding,2018-January,,,277-282,,,3,0,,,,,
230,2-s2.0-85070730757,,,,"Proceedings - 2018 6th International Conference on Learning and Teaching in Computing and Engineering, LaTiCE 2018",cr,Conference Review,,,,,,,,,,2018-04-01,April 2018,"Proceedings - 2018 6th International Conference on Learning and Teaching in Computing and Engineering, LaTiCE 2018",,21100924273,,Conference Proceeding,,,,,,,0,0,,,,,
231,2-s2.0-85048267278,10.1109/TLA.2018.8362135,,,"Green Robotics: Concepts, challenges, and strategies",ar,Article,Alves Filho S.E.,,Universidade do Estado do Rio Grande do Norte,Mossoro,Brazil,,,,,2018-04-01,April 2018,IEEE Latin America Transactions,15480992,19700181218,,Journal,16,4,,1042-1050,,,5,0,,,,,
232,2-s2.0-85046371735,10.3938/NPSM.68.422,,,Electric circuit experiments using physical computing and education programming language,ar,Article,Lee J.,,Korea Institute for Curriculum and Evaluation,Seoul,South Korea,,,,,2018-04-01,April 2018,New Physics: Sae Mulli,03744914,21100432450,22890041,Journal,68,4,,422-430,,,2,0,,,,,
233,2-s2.0-85044360445,10.1109/TRO.2018.2793890,,,Cooperative Collision Avoidance for Nonholonomic Robots,ar,Article,Alonso-Mora J.,,"Department of Cognitive Robotics, TU Delft",Delft,Netherlands,,,,,2018-04-01,April 2018,IEEE Transactions on Robotics,15523098,95101,,Journal,34,2,,404-420,,,86,0,,,,,
234,2-s2.0-85039973992,10.1109/TLT.2017.2682084,,,A Tool for Introducing Computer Science with Automatic Formative Assessment,ar,Article,Benotti L.,,Universidad Nacional de Córdoba,Cordoba,Argentina,,,,,2018-04-01,April-June 2018,IEEE Transactions on Learning Technologies,19391382,19700167026,,Journal,11,2,,179-192,,,38,0,,,,,
235,2-s2.0-85039858426,10.1007/s00170-017-1466-8,,,A STEP-NC compliant robotic machining platform for advanced manufacturing,ar,Article,Toquica J.S.,,Universidade de Brasília,Brasilia,Brazil,,,,,2018-04-01,1 April 2018,International Journal of Advanced Manufacturing Technology,02683768,20428,14333015,Journal,95,9-12,,3839-3854,,,22,0,,,,,
236,2-s2.0-85051016852,10.1109/IGCC.2017.8323602,,,Architecture independent integrated early performance and energy estimation,cp,Conference Paper,Tumeo A.,,Pacific Northwest National Laboratory,Richland,United States,,,,,2018-03-23,23 March 2018,"2017 8th International Green and Sustainable Computing Conference, IGSC 2017",,21100871618,,Conference Proceeding,2017-October,,8323602,1-6,,,3,0,,,,,
237,2-s2.0-85049891001,10.1109/ROBIO.2017.8324506,,,Affordance learning and inference based on vision-speech association in human-robot interactions,cp,Conference Paper,Yi C.,,Foshan University,Foshan,China,,,,,2018-03-23,23 March 2018,"2017 IEEE International Conference on Robotics and Biomimetics, ROBIO 2017",,21100868201,,Conference Proceeding,2018-January,,,1-7,,,1,0,,,,,
238,2-s2.0-85038814062,10.1016/j.neucom.2017.12.012,S0925231217318398,,Torque sensorless decentralized neuro-optimal control for modular and reconfigurable robots with uncertain environments,ar,Article,Dong B.,,Institute of Automation Chinese Academy of Sciences;Changchun University of Technology,Beijing;Changchun,China;China,,,,,2018-03-22,22 March 2018,Neurocomputing,09252312,24807,18728286,Journal,282,,,60-73,,,20,0,,,,,
239,2-s2.0-85050551052,10.1109/ICMIC.2017.8321583,,,Novel industrial robot sorting technology based on machine vision,cp,Conference Paper,Li C.,,Beihang University,Beijing,China,,,,,2018-03-21,21 March 2018,"Proceedings of 2017 9th International Conference On Modelling, Identification and Control, ICMIC 2017",,21100869937,,Conference Proceeding,2018-March,,,902-907,,,6,0,,,,,
240,2-s2.0-85048542014,10.1109/ICORAS.2017.8308073,,,Indoor location and motion tracking system for elderly assisted living home,cp,Conference Paper,Tabbakha N.,,Multimedia University,Selangor,Malaysia,,,,,2018-03-07,7 March 2018,"Proceeding of 2017 International Conference on Robotics, Automation and Sciences, ICORAS 2017",,21100870683,,Conference Proceeding,2018-March,,,1-4,,,19,0,,,,,
241,2-s2.0-85049496448,10.1109/CINE.2017.11,,,Application of Deep Q-Learning for Wheel Mobile Robot Navigation,cp,Conference Paper,Mohanty P.K.,,"National Institute of Technology, Arunachal Pradesh",Yupia,India,,,,,2018-03-06,6 March 2018,"Proceedings - 2017 International Conference on Computational Intelligence and Networks, CINE 2017",,21100902159,,Conference Proceeding,,,8307337,88-93,,,10,0,,,,,
242,2-s2.0-85051499914,10.1142/S1793351X18400093,,,Supporting semantic capture during kinesthetic teaching of collaborative industrial robots,cp,Conference Paper,Stenmark M.,,Cognibotics AB,Lund,Sweden,,,,,2018-03-01,1 March 2018,International Journal of Semantic Computing,1793351X,21100872796,17937108,Journal,12,1,,167-186,,,5,0,,,,,
243,2-s2.0-85045266243,10.1145/3173386.3177536,,,Towards Sign Language Interpreting Robotic System,cp,Conference Paper,Kalidolda N.,,Nazarbayev University,Nur-Sultan,Kazakhstan,,,,,2018-03-01,1 March 2018,ACM/IEEE International Conference on Human-Robot Interaction,,21100236214,21672148,Conference Proceeding,,,,378,,,0,0,,,,,
244,2-s2.0-85045263087,10.1145/3173386.3177085,,,Towards Interpreting Robotic System for Fingerspelling Recognition in Real Time,cp,Conference Paper,Kalidolda N.,,Nazarbayev University,Nur-Sultan,Kazakhstan,,,,,2018-03-01,1 March 2018,ACM/IEEE International Conference on Human-Robot Interaction,,21100236214,21672148,Conference Proceeding,,,,141-142,,,2,0,,,,,
245,2-s2.0-85043790856,10.1109/TCDS.2016.2647439,,,"A Modular Dynamic Sensorimotor Model for Affordances Learning, Sequences Planning, and Tool-Use",ar,Article,Braud R.,,CY Cergy Paris Université,Cergy-Pontoise,France,,,,,2018-03-01,March 2018,IEEE Transactions on Cognitive and Developmental Systems,23798920,21100784665,23798939,Journal,10,1,,72-87,,,6,0,repositoryam,Green,,,
246,2-s2.0-85042864803,10.1109/MC.2018.157113521,,,Programming Spiking Neural Networks on Intel's Loihi,ar,Article,Lin C.K.,,Intel Labs,,Japan,,,,,2018-03-01,March 2018,Computer,00189162,23746,,Trade Journal,51,3,,52-61,,,73,0,,,,,
247,2-s2.0-85042624828,10.1016/j.robot.2017.12.001,S0921889017302981,,Robot learning from demonstrations: Emulation learning in environments with moving obstacles,ar,Article,Ghalamzan E. A.M.,,University of Birmingham,Birmingham,United Kingdom,,,,,2018-03-01,March 2018,Robotics and Autonomous Systems,09218890,18079,,Journal,101,,,45-56,,,31,0,repositoryam,Green,,,
248,2-s2.0-85032669813,10.1007/s10015-017-0401-2,,,Robustness of linearly solvable Markov games employing inaccurate dynamics model,ar,Article,Kinjo K.,,Okinawa Institute of Science and Technology Graduate University,Okinawa,Japan,,,,,2018-03-01,1 March 2018,Artificial Life and Robotics,14335298,144653,16147456,Journal,23,1,,1-9,,,1,1,publisherhybridgold,Hybrid Gold,,,
249,2-s2.0-85031321658,10.1016/j.chb.2017.09.029,S0747563217305551,,"Phogo: A low cost, free and “maker” revisit to Logo",ar,Article,Molins-Ruano P.,,Universidad Autónoma de Madrid,Madrid,Spain,,,,,2018-03-01,March 2018,Computers in Human Behavior,07475632,19419,,Journal,80,,,428-440,,,6,0,,,,,
250,2-s2.0-85049371070,10.1109/SIET.2017.8304183,,,Web-based real time monitoring of electrical quantities measurement,cp,Conference Paper,Despa D.,,Universitas Lampung,Bandar Lampung,Indonesia,,,,,2018-02-27,27 February 2018,"Proceedings - 2017 International Conference on Sustainable Information Engineering and Technology, SIET 2017",,21100866694,,Conference Proceeding,2018-January,,,464-470,,,0,0,,,,,
251,2-s2.0-85045385341,10.1145/3168824,,,High performance stencil code generation with lift,cp,Conference Paper,Hagedorn B.,,Westfälische Wilhelms-Universität Münster,Munster,Germany,,,,,2018-02-24,24 February 2018,CGO 2018 - Proceedings of the 2018 International Symposium on Code Generation and Optimization,,21100875943,,Conference Proceeding,2018-February,,,100-112,,,63,0,repositoryam,Green,,,
252,2-s2.0-85046620169,10.1109/ICOEI.2017.8300979,,,Voice controlled Humanoid Robot with artificial vision,cp,Conference Paper,Sai U.B.,,Potti Sriramulu Chalavadi Mallikarjunarao College of Engineering and Technology,Vijayawada,India,,,,,2018-02-21,21 February 2018,"Proceedings - International Conference on Trends in Electronics and Informatics, ICEI 2017",,21100859905,,Conference Proceeding,2018-January,,,505-508,,,9,0,,,,,
253,2-s2.0-85046076169,10.1145/3159450.3159501,,,Enhanced robotics! Improving building and programming learning experiences for students with visual impairments,cp,Conference Paper,Ludi S.,,University of North Texas,Denton,United States,,,,,2018-02-21,21 February 2018,SIGCSE 2018 - Proceedings of the 49th ACM Technical Symposium on Computer Science Education,,21100858344,,Conference Proceeding,2018-January,,,372-377,,,5,0,,,,,
254,2-s2.0-85046034561,10.1145/3159450.3159526,,,An analysis of a media-Based approach to teach programming to middle school students,cp,Conference Paper,Araujo L.,,Universidade Estadual de Feira de Santana,Feira de Santana,Brazil,,,,,2018-02-21,21 February 2018,SIGCSE 2018 - Proceedings of the 49th ACM Technical Symposium on Computer Science Education,,21100858242,,Conference Proceeding,2018-January,,,1005-1010,,,9,0,,,,,
255,2-s2.0-85044405952,10.1088/1757-899X/296/1/012049,,,Design of Intelligent Robot as A Tool for Teaching Media Based on Computer Interactive Learning and Computer Assisted Learning to Improve the Skill of University Student,cp,Conference Paper,Zuhrie M.,,Universitas Negeri Surabaya,Surabaya,Indonesia,,,,,2018-02-21,21 February 2018,IOP Conference Series: Materials Science and Engineering,17578981,19700200831,1757899X,Conference Proceeding,296,1,012049,,,,0,1,publisherfree2read,Bronze,,,
256,2-s2.0-85050685302,10.1109/ICTP.2017.8285918,,,Module-based Edukit for teaching and learning 8051 microcontroller programming,cp,Conference Paper,Ali L.,,Bangladesh University of Engineering and Technology,Dhaka,Bangladesh,,,,,2018-02-07,7 February 2018,"2nd IEEE International Conference on Telecommunications and Photonics, ICTP 2017",,21100870387,,Conference Proceeding,2017-December,,,57-61,,,3,0,,,,,
257,2-s2.0-85050671801,10.1109/URTC.2017.8284202,,,Annotated reconstruction of 3D spaces using drones,cp,Conference Paper,Nair S.,,California Institute of Technology,Pasadena,United States,,,,,2018-02-07,7 February 2018,"2017 IEEE MIT Undergraduate Research Technology Conference, URTC 2017",,21100870347,,Conference Proceeding,2018-January,,,1-5,,,3,0,repositoryam,Green,,,
258,2-s2.0-85045329599,10.1109/ICCSP.2017.8286579,,,Robotic motion control using machine learning techniques,cp,Conference Paper,Aparanji V.,,Siddaganga Institute of Technology,Tumkur,India,,,,,2018-02-07,7 February 2018,"Proceedings of the 2017 IEEE International Conference on Communication and Signal Processing, ICCSP 2017",,21100859902,,Conference Proceeding,2018-January,,,1241-1245,,,5,0,,,,,
259,2-s2.0-85050406453,10.1109/APSIPA.2017.8282002,,,Automatic object searching by a mobile robot with single RGB-D camera,cp,Conference Paper,Shim V.A.,,"A-Star, Institute for Infocomm Research",Singapore City,Singapore,,,,,2018-02-05,5 February 2018,"Proceedings - 9th Asia-Pacific Signal and Information Processing Association Annual Summit and Conference, APSIPA ASC 2017",,21100869472,,Conference Proceeding,2018-February,,,56-62,,,5,0,,,,,
260,2-s2.0-85047069903,10.1109/ICCMC.2017.8282684,,,Hardware realization of neural network based controller for autonomous robot navigation,cp,Conference Paper,Aamer N.,,Vinayaka Mission's Research Foundation,Salem,India,,,,,2018-02-05,5 February 2018,"Proceedings of the International Conference on Computing Methodologies and Communication, ICCMC 2017",,21100861705,,Conference Proceeding,2018-January,,,243-248,,,4,0,,,,,
261,2-s2.0-85056261091,10.11936/bjutxb2017020014,,,Humanoid Robot Imitation Learning Based on COM Correction and Compensation,ar,Article,Yu J.,,Beijing University of Technology;Beijing Key Laboratory of Computational Intelligence and Intelligent System,Beijing;Beijing,China;China,,,,,2018-02-01,1 February 2018,Beijing Gongye Daxue Xuebao/Journal of Beijing University of Technology,02540037,145725,,Journal,44,2,,193-199,,,3,0,,,,,
262,2-s2.0-85044504702,10.1109/RITA.2018.2801898,,,Integrating Formative Feedback in Introductory Programming Modules,ar,Article,Anfurrutia F.I.,,Universidad del Pais Vasco,Leioa,Spain,,,,,2018-02-01,February 2018,Revista Iberoamericana de Tecnologias del Aprendizaje,,19700201532,19328540,Journal,13,1,,3-10,,,2,0,,,,,
263,2-s2.0-85030121361,10.1016/j.eswa.2017.09.023,S0957417417306243,,Automatic discovery of concepts and actions,ar,Article,Tenorio-González A.C.,,Instituto Nacional de Astrofisica Optica y Electronica,Puebla,Mexico,,,,,2018-02-01,February 2018,Expert Systems with Applications,09574174,24201,,Journal,92,,,192-205,,,3,0,,,,,
264,2-s2.0-85028559289,10.1007/s10956-017-9709-x,,,How Does the Degree of Guidance Support Students’ Metacognitive and Problem Solving Skills in Educational Robotics?,ar,Article,Atmatzidou S.,,Aristotle University of Thessaloniki,Thessaloniki,Greece,,,,,2018-02-01,1 February 2018,Journal of Science Education and Technology,10590145,23646,15731839,Journal,27,1,,70-85,,,36,0,,,,,
